Topic,Count,Name,Representation,Representative_Docs
0,587,0_president_the_news_biden,"['president', 'the', 'news', 'biden', 'fox', 'border', 'and', 'to', 'house', 'on']","[""House Republicans are aiming for a discussion with Special Counsel Robert Hur on his findings about President Biden's handling of classified documents, sources told Fox News Digital."", 'Fox News host Laura Ingraham says the media would have criticized former President Trump if he delivered the same State of the Union President Biden did.', 'Fox News host Sean Hannity gives his take on concerns over President Biden\'s cognitive state after the special counsel said he has ""poor memory.""']"
1,573,1_in_police_of_was,"['in', 'police', 'of', 'was', 'arrested', 'the', 'to', 'and', 'after', 'on']","['Two off-duty police officers in Nebraska were not charged after fatally shooting two men who were in the country illegally. The police officers were working security at a bar.', 'A Texas man wanted in connection for a murder in Austin was arrested over the weekend in Mexico and deported back to the United States, police said.', 'Five migrants who police say were part of a mob that attacked two NYPD police officers in Times Square are in custody, while another has posted bail and been released.']"
2,430,2_the_bowl_super_kansas,"['the', 'bowl', 'super', 'kansas', 'chiefs', 'her', 'to', 'taylor', 'city', 'in']","['The Kansas City Chiefs have taken home Super Bowl LVIII for the second year in a row. Check out every team that has won the Super Bowl since its first game in 1967.', 'Brittany Mahomes, the wife of Kansas City Chiefs star Patrick Mahomes, made clear that her husband is ""so ready"" for Super Bowl LVIII against the San Francisco 49ers.', ""Taylor Swift's appearance at Super Bowl LVIII in Las Vegas to support the Kansas City Chiefs and boyfriend Travis Kelce on Sunday will likely be a game day decision.""]"
3,333,3_the_to_of_in,"['the', 'to', 'of', 'in', 'and', 'israel', 'on', 'for', 'hamas', 'war']","['The head of the U.N. agency for Palestinian refugees said there is an urgent need for new funding from the EU due to potential Israeli military action in Gaza.', ""President Biden has cursed out Israeli Prime Minister Netanyahu in private, according to an NBC News report on the president's thoughts on the ongoing war."", 'Pro-Palestinian protesters outside President Biden\'s campaign events in New York City this week said that Biden is a ""danger"" for his support of Israel\'s war in Gaza.']"
4,279,4_bill_the_to_of,"['bill', 'the', 'to', 'of', 'would', 'and', 'in', 'on', 'state', 'that']","['The bill, which would ban social media use for minors under the age of 16 in the Sunshine State, now goes on to the Florida House for a vote where the speaker has made the issue a priority.', 'The Georgia Senate on Thursday passed a bill that would ban libraries from spending public and private funds on the American Library Association.', 'Both the Virginia state house and senate have passed legislation that would institute a ""tech tax"" on businesses in the state, which would expand sales tax to cover digital goods.']"
5,234,5_the_to_on_nba,"['the', 'to', 'on', 'nba', 'his', 'game', 'at', 'win', 'for', 'in']","['Denny Hamlin will hope to start the 2024 NASCAR season off on the right foot with the fourth Daytona 500 victory over his career on Monday.', 'The NASCAR Cup Series season will start its third race of the year at Las Vegas Motor Speedway. Fans will be able to watch the race on FOX at 3:30 p.m. ET.', ""BOSTON -- Michael Ryder scored twice in the Bruins' 5-3 Game 2 win against the Buffalo Sabres Saturday and is a big reason why the Bruins can seize the advantage in the Stanley Cup Playoff series with a win in Game 3 Monday (7 p.m. ET, Versus, CBC).""]"
6,176,6_died_the_in_was,"['died', 'the', 'in', 'was', 'death', 'of', 'at', 'navalny', 'alexei', 'her']","['Yulia Navalnaya, the wife of Putin critic Alexei Navalny, is calling on the world to ""defeat the catastrophic regime that is currently in Russia"" following reports that her husband collapsed and died in custody at a penal colony in Siberia.', ""Prominent Vladimir Putin critic and opposition leader Alexei Navalny has died Friday at the age of 47, Russia's prison agency says."", ""Alexei Navalny's mother has released a video demanding Russian President Vladimir Putin return the body of her son, who officials say died last week at a penal colony in Siberia.""]"
7,161,7_in_killed_houthi_the,"['in', 'killed', 'houthi', 'the', 'people', 'sea', 'crashed', 'were', 'two', 'fire']","['Six Houthi one-way attack drones that ""were an imminent threat"" have been shot down in the Red Sea on Thursday, according to U.S. Central Command.', 'Iran-back Houthi rebels in Yemen fired two missiles at a commercial ship in the Red Sea bound for an Iranian port city from Brazil, authorities said.', 'A helicopter crashed into the North Sea on Wednesday night during a training mission, killing one person and injuring five in Norway. There were six people on board.']"
8,138,8_the_to_new_city,"['the', 'to', 'new', 'city', 'mayor', 'and', 'of', 'transgender', 'school', 'york']","[""New York City Mayor Eric Adams sat down with FOX anchor Rosanna Scotto to discuss the role the Big Apple's sanctuary city status played in fueling its migrant crisis."", 'FOX 5 New York\'s Rosanna Scotto shed light on New York City\'s struggles with migrants, telling Bret Baier that Mayor Eric Adams has had an ""epiphany"" on the city\'s sanctuary status.', ""New York City Mayor Eric Adams has appealed for the state to cover half of the city's illegal migrant crisis, which has drained city resources over the past two years""]"
9,101,9_your_you_these_and,"['your', 'you', 'these', 'and', 'of', 'the', 'valentines', 'day', 'can', 'to']","['Whether your favorite gym equipment is the treadmill or lifting weights, these fitness items can help you bring the gym to your home.', 'To save money and add personalized touches to your wedding day, consider more of a DIY approach. This guide is full of wedding items you can make yourself.', 'Book your next vacation to one of these towns, and make sure you have everything you need with these items. Check out this 10 items available on Amazon.']"
10,73,10_coast_in_the_of,"['coast', 'in', 'the', 'of', 'boat', 'and', 'on', 'off', 'mountain', 'after']","[""A boat carrying migrants bound for Europe capsized off Senegal's coast this week, resulting in the death of at least two dozen people and multiple injuries."", 'At least 13 Sudanese migrants have been confirmed dead and 27 others have been reported missing after a small metal boat carrying them sank off the Tunisian coast Thursday.', ""At least four migrants have been reported dead and two more remain missing after a boat carrying over two dozen capsized off Panama's eastern coast.""]"
11,57,11_reddit_book_by_her,"['reddit', 'book', 'by', 'her', 'mom', 'drama', 'of', 'to', 'the', 'books']","['An unusual wedding drama elicited some 3,500 reactions on Reddit as a bride described how her new sister-in-law became upset after the reception and did not want the married couple to depart.', ""A family drama described on Reddit has elicited over 1,300 reactions to date as a young mother of two babies reveals why she will not care for her husband's sick grandmother."", 'A viral relationship drama posted on social media has elicited over 7,000 reactions, with people sharing on Reddit why they support a woman who left a date abruptly; the man lied about his age.']"
12,57,12_to_the_cancer_of,"['to', 'the', 'cancer', 'of', 'doctors', 'and', 'health', 'that', 'help', 'us']","['The National Cancer Institute announced a new program to study HPV testing via self-collection to prevent cervical cancer. Cancer experts Drs. Brian Slomovitz and Nicole Saphier discuss this method.', 'Researchers found that certain proteins may predict dementia more than 10 years before diagnosis. A study found that new blood tests can help doctors with early detection.', ""Amid reports that the CDC may be considering a change to its COVID isolation guidelines, doctors are sharing their recommendations for when it's OK for people who test positive to end quarantine.""]"
13,55,13_ai_cyberguy_knutsson_your,"['ai', 'cyberguy', 'knutsson', 'your', 'and', 'kurt', 'to', 'technology', 'artificial', 'how']","['Stay up to date on the latest AI technology advancements and learn about the challenges and opportunities AI presents now and for the future.', 'Stay up to date on the latest AI technology advancements and learn about the challenges and opportunities AI presents now and for the future.', 'Stay up to date on the latest AI technology advancements and learn about the challenges and opportunities AI presents now and for the future.']"
14,42,14_missing_misrach_scully_princeton,"['missing', 'misrach', 'scully', 'princeton', 'ewunetie', 'dormitory', 'universitys', 'spotted', 'am', 'campus']","['missing', 'missing', 'missing']"
15,38,15_election_minister_prime_pakistans,"['election', 'minister', 'prime', 'pakistans', 'khan', 'imran', 'elections', 'the', 'of', 'in']","[""Pakistan's National Assembly on Thursday swore in newly-elected members of parliament, despite election integrity protests by supporters of imprisoned former Prime Minister Imran Khan."", ""Imprisoned former Prime Minister Imran Khan of Pakistan is urging the International Monetary Fund to link talks with the government to an audit of this year's election."", ""A power-sharing agreement was announced by rivals of Pakistan's imprisoned former Prime Minister, Imran Khan, late Tuesday. Shehbaz Sharif will serve as joint candidate for Prime Minister.""]"
16,31,16_charles_prince_king_iii,"['charles', 'prince', 'king', 'iii', 'harry', 'cancer', 'his', 'diagnosis', 'royal', 'sussex']","['In an interview with ""Good Morning America,"" Prince Harry admitted he\'s ""considered"" becoming a U.S. citizen. The British royal is the younger son of King Charles III.', 'A royal expert told Fox News Digital that Prince William ""is not meeting"" with his brother Prince Harry during his visit to the U.K. following King Charles\' cancer diagnosis.', ""Prince Harry broke his silence on his estranged father King Charles' cancer diagnosis in a bombshell interview. The Duke of Sussex said Charles' illness could reunify the family.""]"
17,20,17_discovered_the_archaeologists_year,"['discovered', 'the', 'archaeologists', 'year', 'nasa', 'ancient', 'lunar', 'discovery', 'hole', 'moon']","['An unmanned Japanese spacecraft that landed on the moon last month has transmitted data on 10 lunar rocks that could provide clues about the origin of the moon.', ""Astronomers reported Friday that three new moons  one orbiting Uranus and two orbiting Neptune  have been discovered, placing each planet's lunar tally at 28 and 16 known moons."", ""Astronomers have reportedly discovered the brightest object in the universe, a quasar with a rapidly-growing black hole that swallows the equivalent of Earth's Sun per day.""]"
18,13,18_pig_dog_animal_rescued,"['pig', 'dog', 'animal', 'rescued', 'their', 'captured', 'now', 'owner', 'working', 'adopted']","['A pig named Kevin Bacon surprised a Wisconsin family when he appeared on their security camera -- and then ate a whole bunch of their snacks. He is safe home now.', ""A Tennessee family that was missing a package from their front porch learned that their neighbor's dog had stolen it while their own dog looked on. The moment was captured on video."", 'A captured pig has been dubbed ""Thanos"" by the Wake County Animal Center. Per state law, he will be auctioned off in 10 days if his owner does not come forward.']"
