Topic,Document_description,Document_name
2,"Kansas City Chiefs quarterback Patrick Mahomes said he likes playing the ""villian role"" as his team prepares for the San Francisco 49ers in Super Bowl LVIII.",Patrick Mahomes likes playing the villain role as Chiefs prepare for Super Bowl LVIII
11,Abraham Lincoln was a corned beef connoisseur and historians suggest his taste for it fueled the delicious dishes associated with St. Patrick's Day in the United States.,"Here's how Abe Lincoln, corned beef connoisseur, flavored America's St. Patrick's Day celebrations"
4,"LUCKNOW, India (AP)  At least 24 people drowned and 11 others were missing after a boat capsized on the Ganges river in northern India early Monday, police said.",35 feared drowned as boat capsizes in Ganges river in northern India
1,A federal judge appointed to the bench by President Biden largely dismissed a class-action lawsuit targeting the sale of gas-powered stovetops over their emissions.,Biden-appointed judge delivers blow to climate lawsuit targeting gas stoves
6,"Lt. Ralph Perkner, who served in World War II and the Korean War, celebrated his 103rd birthday in a Pennsylvania restaurant filled with family and friends.","WWII vet turns 103, credits daughters for his longevity: 'Makes me stronger'"
2,"Prior to facing each other on the court, Detroit Pistons' Isaiah Stewart reportedly punched Phoenix Suns' Drew Eubanks in the face in the tunnels of the Suns' arena.","Members of Pistons, Suns get into altercation in tunnels of arena before game: report"
1,"A Pennsylvania teenage girl was fatally stabbed by her former boyfriend in front of a police officer outside her home last week, authorities said.",Pennsylvania man fatally stabs ex-girlfriend in front of authorities before stabbing himself: police
2,Three-time NFL All-Pro wide receiver Chad Johnson raised eyebrows when he announced he would be joining the Las Vegas Raiders' staff in some capacity.,Former Bengals star Chad Ochocinco Johnson hints he's joining an NFL staff: 'I got a job with the Raiders'
0,Fox News host Jesse Watters unpacks the significance of the Supreme Court's 9-0 ruling in the Trump Colorado ballot ban case on 'Jesse Watters Primetime.',JESSE WATTERS: Democrats will now have to persuade voters instead of nine judges
14,Sri Lankan Environment Minister Keheliya Rambukwella has resigned from his post after being arrested for his alleged involvement in a counterfeit drug purchase.,Top Sri Lankan official out after counterfeit drug scandal arrest
12,"There is an urgent need for a structured and unified approach to AI within federal and state agencies, and AI Centers of Excellence offer a valuable solution.",Navigating the AI maze in government agencies
3,"Iran blamed Israel for a an attack sabotaging a major gas pipeline in the country, providing no evidence but claiming it was an 'Israeli plot.'","Iran accuses Israel of blowing up natural gas pipeline in sabotage attack, provides no evidence"
0,"President Biden was asked about growing concerns over his age during a friendly interview with ""Late Night"" host Seth Meyers as the issue plagues his re-election bid.",Biden shrugs off age concerns during friendly Seth Meyers chat: 'It's about how old your ideas are'
10,Virtual Incision believes the successful demonstration of MIRA would mean that the system could help medical professionals assist remote rural communities.,Space surgery experiment could provide pathway for medical care in Earth's most remote regions
5,Democratic assemblymemberJoaquin Arambula proposes new bill that would expand eligibility for a state loan program for first-time home buyers to include illegal immigrants.,New California bill would make illegal immigrants eligible for first time homebuyer loans
0,"Fox News host Laura Ingraham asks what Hunter Biden and his Uncle James did to make money overseas on Wednesday's ""The Ingraham Angle.""",LAURA INGRAHAM: The only product the Biden boys had to sell was influence and a connection to 'The Big Guy'
8,"The trial of a Catholic activist in Belarus has been condemned by European diplomats for being ""politically motivated"" after mass protests against President Lukashenko.","Belarus Catholic activist up for closed-door ""politically motivated"" trial"
3,A group of pro-Palestinian Democrats in Michigan are threatening to stay home over President Biden's handling of the ongoing war between Israel and Hamas.,MSNBC warns Biden 'has a problem' in MI as his 2020 voters turn on him: Not 'stupid enough to elect you again'
2,"MLB's decision to take a couple seconds off the pitch clock for the upcoming season was premature, at least according to the executive director of the players' association.","MLB union rips decision to shorten pitch clock time, says players expressed concerns"
0,Former President Donald Trump endorsed former Navy SEAL Tim Sheehy for the Montana Senate over Rep. Matt Rosendale,Donald Trump endorses 'American Hero' Tim Sheehy in battleground Senate race
8,"In interviews with Fox News chief political anchor Bret Baier, several Ukrainians said they do not want to be forced to leave their homeland amid Russian aggression.",Kyiv residents speak out as Ukraine war enters third year: 'I try to be optimistic'
1,Police have arrested a man they say tried to use a hammer and chisel to break through the wall of a temp agency to commit a burglary. Authorities arrested a 35-year-old man after he tried to chi...,Police charge Pa. man with chiseling hole into building wall in burglary attempt
2,Texas Longhorns quarterback Arch Manning is reportedly opting out of appearing in EA Sports' college football video game set for release in the summer.,Texas' Arch Manning will not opt to appear in EA Sports college football video game: report
0,"Labor Secretary Eugene Scalia told""Bill Hemmer Reports""Thursday thatskyrocketing unemployment numbers due to self-imposed shutdowns of businesses and commerce caused by the coronavirus pandemic were ""especially difficult"" to stomach.",Labor secretary warns economic recovery depends on how seriously Americans take coronavirus restrictions
0,"Fox News host Greg Gutfeld weighs in on President Biden's HHS Assistant Secretary Adm. Rachel Levine ""pushing a government program that stirs up racial discord"" on ""Gutfeld!""",GREG GUTFELD: Our health is now the next target for identity based ideology
3,Sen. Josh Hawley demands McKinsey & Company to disclose past or current contracts with Chinese regime amid national security concerns.,Sen Hawley warns consulting firms against working with China to 'undermine America'
6,"The Opera Philadelphia announced Missy Mazzoli's ""The Listeners"" will open the season in September after being cut from the lineup in 2020 for financial reasons.",Missy Mazzoli's 'The Listeners' finally gets premiere date at Opera Philadelphia after four-year delay
6,"Ann-Margret, a '60s actress and sex symbol, starred in ""Viva Las Vegas"" with Elvis Presley and with Bobby Rydell in ""Bye Bye Birdie."" She toured alongside Bob Hope to support American troops.","Ann-Margret, 82, still rides her Harley-Davidson: I love speed"
16,Mexican archaeologists from the INAH discovered a complex burial system during an excavation in Pozo de Ibarra. The bones may date from 500 to 850 AD.,Archaeologists uncover hoard of ancient skeletons part of 'complex funerary system'
1,The Prince George's County Police Department announced on Monday that a fifth suspect has been arrested in connection with the murder of a Maryland 2-year-old boy.,Salvadoran illegal immigrant arrested in connection to Maryland murder of 2-year-old boy
0,"Sen. McConnell faced scrutiny as the GOP opposed the emergency border bill with aid for Ukraine, Israel and Taiwan, which was defeated in a 50-49 vote.","Republican rage against McConnell rises after border deal debacle, Ukraine funding push"
1,"The two candidates were gunned down in their cars at different times on Monday, continuing a dangerous trend of attacks against political candidates that has only increased over the years.",Cartels suspected of gunning down 2 mayoral candidates in same Mexican city
4,A tourist helicopter in Colombia crashed into a building moments after taking off  and all six people onboard survived the crash.,WATCH: Tourists in Colombia left hanging after helicopter plummets shortly after takeoff
3,Nicaragua has granted political asylum to former Panamanian President Ricardo Martinelli just days after a criminal appeal in his home country fell through.,Nicaragua grants asylum to former President Martinelli of Panama
15,"Barney Chandler has taken over as the new ravenmaster at the Tower of London. According to a prophecy, if the ravens leave the fortress, the Kingdom of England will fall","New ravenmaster at Tower of London has most important job in England, according to legend"
5,GA lawmakers have proposed a religious rights protection bill. Opponents say it would provide a legal shield for discrimination against LGBTQ+ people in the name of religion.,Critics of Georgia religious rights protection bill say it would be used for discrimination
6,"Jennifer Lopez said she doesn't like when other women flirt with her husband, Ben Affleck, admitting on ""Today with Hoda & Jenna"" that she gets jealous.","Jennifer Lopez warns Ben Affleck is off limits, telling anyone who flirts with him to 'step all the way off'"
8,"Lolita Bogdanova, an OnlyFans model from Ukraine who took photos with her breasts exposed in front of St. Basil's Cathedral in Red Square, is being hunted by Russian authorities.",Russian government hunting Ukrainian OnlyFans model who posed topless in front of church
15,"As the Princess of Wales is recovering from abdominal surgery, King Charles III is receiving treatment for cancer. Princess Kate is at the familys Adelaide Cottage in Windsor.",Kate Middleton 'worried' after King Charles' cancer forces Prince William back to work: author
5,"Democratic Maine Gov. Janet Mills unveiled a $71 million supplemental budget on Wednesday, which includes several security initiatives in light of the Lewiston shooting.","Maine Gov. Mills proposes $71M supplemental budget, with focus on Lewiston massacre"
1,Police in southern Oregon say a woman charged with robbing a bank in Grants Pass stopped to pick up her children at school on the way home. The Grants Pass Daily Courier reported a woman walked ...,"Police say Oregon woman robbed bank, then picked up daughters at elementary school"
1,"Two Pennsylvania brothers convicted of murdering their parents and younger sibling almost 30 years ago have been resentenced, offering them a chance at parole.","Pennsylvania brothers who killed parents, younger sibling in 1995 offered chance at parole"
12,An AI weapon detection software company hopes to use its new program to help prevent shootings in schools and other venues. The veteran-run company draws its expertise from technologists and former Navy SEALS.,"AI weapon detection company seeks to prevent school, other shootings: 'a proactive measure'"
1,Police in Michigan are looking for a man and woman accused of skipping out on a restaurant bill prior to running over their server in the parking lot.,Police searching for couple accused of running over server after restaurant bill dispute
1,"Kenneth Rogers, 28, was arrested after he allegedly struck another man with a hatchet multiple times near a SEPTA station early Sunday.",Philadelphia suspect arrested after striking victim with hatchet near SEPTA station: police
0,"House Speaker Nancy Pelosi promised four years ago that Democrats would lead ""the most honest, most open, most ethical Congress in history.""But as her party defends its record with its majority in jeopardy, two prominent Democrats await ethics trials. Two other party members gave Congressional Black Caucus Foundation scholarships to relatives. Most importantly, lobbyists, corporations and special interests still have unimpeded ways to buy access to members of Congress.",Pelosi's 'Most Ethical Congress' Pledge Falters 
6,"When entering the world of online dating, it's wise to stay vigilant on Valentine's Day to avoid being victimized by a scamming Casanova.",Stop these V-day scams before they break your heart and your bank account
3,"Argentinian President Javier Milei is spending three days in Israel, where he will visit a kibbutz devastated by the Oct. 7 Hamas attack and meet with Israeli leadership.","Argentina's maverick Javier Milei pledges to move embassy to Jerusalem, Bibi praises 'dear friend'"
0,"DePauw University announced Wednesday its recent receipt of $200 million in donations, the largest reported gift in the liberal arts school's history.",Indiana's DePauw University rakes in record $200M in donations
0,"Some commentators attacked Special Counsel Robert Hur for asking President Biden about his son's death, but later reporting said it was the president who brought him up.",Liberal commentators complained about Hur questioning president about Beau Biden's death
4,A 13-year-old girl from southern Illinois has died after sustaining a gunshot wound to her head while on a relative's porch. The shooting occurred on February 3.,Illinois teen dies days after being shot on front porch of home
3,"Houthi militants in Yemen are using Iranian-supplied missiles and drones to attack targets across the Middle East, analysis from the Defense Intelligence Agency (DIA).","Houthis using Iranian missiles, drones to attack civilian, military targets across Middle East, DIA confirms"
5,The Kentucky Senate's Bill 1 this session will be a measure meant to catalyze research collaboration between the state's universities in an effort to raise Kentucky's research profile.,Kentucky bill would foster cutting-edge research collaboration between universities
3,"Visits to the Eiffel Tower were disrupted on Monday due to a strike by employees protesting the poor financial management of the monument, a popular tourist site.",Eiffel Tower visits disrupted by strike protesting poor financial management of the Paris landmark
7,"USWNT captain Lindsey Horan issued an apology Thursday after her remarks saying American soccer fans arent smart"" received major backlash earlier this month.",USWNT captain Lindsey Horan apologizes for comments saying American fans arent smart
1,"Walter Richardson of West Virginia was sentenced to life in prison without the possibility of parole in the death of his girlfriend's 4-year-old son, to which he pleaded no contest.",West Virginia man who killed girlfriend's 4-year-old son to serve life in prison with no parole
0,"More than 50% of Americans are now saying that large numbers of illegal immigrants are a ""critical"" threat to U.S. vital interests, according to a new poll released Tuesday.",New poll reveals record-high number of Americans view this issue as 'critical threat' to US interests
9,"If Woods can't be the Tiger of old, he's better off giving up",Tiger facing tough questions
0,Gun Owners of America is asking U.S. senators to press Treasury Secretary Janet Yellen for answers on how her department is monitoring financial transactions involving firearms.,Gun rights group urges senators to press Yellen over Treasury targeting gun transactions
5,"The Georgie House voted to pass Senate Bill 233, which powers a voucher funding plan, which will also cover private school tuition and homeschooling.",Georgia school voucher bill narrowly clears longtime obstacle with state House passage
5,"Maine lawmakers have introduced extensive gun violence measures, including a 72-hour waiting period for most gun purchases, following the state's deadliest shooting.",Maine Democrats seek comprehensive gun control measures following state's deadliest shooting
3,"CHOLISTAN DESERT, Pakistan (AP)  Fighter jets strafed mock enemy positions and tanks rumbled across this eastern desert in a display of military might signaling Pakistan's readiness to face tra...","Close to India, Pakistan shows military might"
5,"Alabama's controversial Supreme Court ruling makes future access to IVF uncertain. Democrats and activists are railing against it, but they're also hoping it will galvanize voters.","Alabama IVF ruling reignites debate on abortion, a motivating issue for Democrats ahead of election"
2,The San Diego Chargers have agreed to terms year contract.Royal caught 19 passes for 155 yards and one touchdown in 12 games for the Broncos last year,Chargers agree to terms with WR Royal
4,"Five people were killed when a single-engine plane crashed in Nashville, Tennessee, after it was forced to make an emergency landing near Interstate 40.","Five people killed in single-engine plane crash in Nashville, officials say"
2,"Pro Football Hall of Famer Kurt Warner recalled the most famous play of his first Super Bowl title called ""The Tackle"" with Fox News Digital.",NFL legend Kurt Warner recalls Super Bowl XXXIV's most famous moment
3,U.S. Secretary of State Antony Blinken met Brazil's President Luiz Inacio Lula da Silva following Lula's likening of the Israel-Hamas war to the Holocaust.,Secretary of State Blinken meets with Brazil's president after incendiary Gaza comments
4,"Ed Ott, a former catcher for the Pittsburgh Pirates and California Angels who won a World Series ring in 1979, has died, the Pirates announced Sunday.","Ed Ott, who won World Series with Pirates, dead at 72"
7,"Experts point to the pandemic, social media and the political polarization of society as major reasons why we've seen an uptick in interest for religious meaning among Gen Z Americans.",Campus religious groups report greater interest from students trying to find meaning in 'crumbling' culture
7,A legal settlement in California highlighted how school shutdowns during the coronavirus pandemic were a detriment to students of color who experienced learning loss.,Major legal settlement in California highlights COVID school closure's negative impact on students of color
6,"An unusual wedding drama elicited some 3,500 reactions on Reddit as a bride described how her new sister-in-law became upset after the reception and did not want the married couple to depart.",Bride with 'severe anxiety' leaves her own wedding reception after family member's 'tantrum'
15,A video was released to social media of King Charles III receiving many of the cards he's been sent since announcing his cancer diagnosis earlier this month.,King Charles enjoys cheeky get-well card from one of his supporters
13,"President Obama is set on Tuesday to reassure Americans that his administration is up to the task of coping with the nation's worst environmental crisis, the product of a blown-out BP well that has been gushing crude oil for 57 days deep in the Gulf of Mexico.","In First Oval Office Speech, Obama Seeks to Ease Political Damage of Gulf Crisis"
15,"Showing support for cancer comes in many forms but would you go bald for it? Thats the challenge issued by Be Bold, Be Bald!, a campaign by non-profit Small Army for a Cause. ","Bald and strong: Nonprofit raises cancer awareness, challenges vanity"
1,A Texas man was shot and killed while in his home with his family after three perpetrators failed to steal his truck before breaking into his home.,"Texas man shot, killed after 3 men tried to steal his truck, break into his home: police"
7,"A proposal to blend two Washington, D.C., schools with very different racial backgrounds is leading to tense debates among parents and district officials.",Plan to blend predominantly Black and White DC schools leads to tense debate in liberal neighborhood
4,"Laurence Brett, a former priest who vanished twice amid accusations that he sexually abused more than two dozen children in the U.S., has died in the French Caribbean island of Martinique, a hos...",US priest accused of pedophilia dies in Martinique
6,"Fans are analyzing Billy Ray Cyrus' latest Instagram post after his daughter, Miley Cyrus, left him out of her 2024 Grammy Awards acceptance speech.",Billy Ray Cyrus shares cryptic message about 'love' amid rift with Miley and Tish Cyrus
0,A Biden campaign call regarding the National Rifle Association went off topic after reporters instead focused on questioning the president's mental health.,"Biden campaign call sidetracked by fitness questions, surrogates insist he is 'in full control'"
6,"Helen Mirren revealed to Fox News Digital before the American Cinematheque Awards that she has made ""missteps"" turning down roles in her career.",Helen Mirren reveals regrets over roles she turned down
4,"Teenager Sandra Young's remains were found in 1970, but not identified until last fall using genetic genealogy.",Remains of Oregon teenager identified after 54 years using advanced genetic genealogy
2,"Taylor Swift and Kanye West have had a beef since the VMAs incident in 2009, and apparently, it led to Swift having West kicked out out of the Super Bowl.","Taylor Swift got Kanye West 'kicked out' of Super Bowl, ex-NFL star says"
1,An illegal immigrant wanted for homicide and a migrant with a conviction for the molestation of a minor have been apprehended in Texas near the southern border.,"Migrant wanted for homicide, convicted child predator arrested at Texas border"
0,"President Biden is planning to spend $30 million in election ads over the next six weeks to continue momentum from his aggressive State of the Union speech, his campaign said.","Biden campaign launches $30 million ad buy following aggressive, political SOTU"
0,"President Biden is lagging behind former President Trump in a New York Times poll released Saturday, with Americans skeptical of Biden's leadership.",Biden hit with record disapproval rating in new poll as Trump holds lead
2,"ORLANDO, Fla. (AP)  Stan Van Gundy turned to his assistant coaches on the Orlando Magic bench, unsure what to do with star Dwight Howard finally avoiding foul trouble and his team on his way to a blowout victory.","Superman Returns: Howard, Magic crush Hawks 114-71"
3,"Protesters threw gasoline bombs and firecrackers at police outside Greece's parliament on March 8, 2024, after a demonstration against government plans for privately run universities",Greek protesters throw firebombs to protest introduction of private universities
7,"Teachers and activists are arguing over teaching ethnic studies"" and the history of oppression in California as the Israel-Hamas war continues to divide progressives.","California students required to learn 'ethnic studies' face debate over Gaza war, understanding Jews as White"
9,Competitors will fly like Superman during the worlds first jet suit race Feb. 28 at the Dubai Boat Show at the Dubai Harbour. The sport is taking off.,Worlds first jet suit race turns flying humans into an extreme sport
0,"Before the release of Special Counsel Robert Hur's damning report calling out President Biden's ""poor memory,"" Democrats lined up in defense of his age.",FLASHBACK: Dems ran defense on Biden's age before Special Counsel put damning spotlight on his 'poor memory'
4,"A body recovered from a truck in an east Alabama lake was positively identified as Oscar Lewis King, who went missing more than ten years ago.",Remains found in truck at bottom of Alabama lake confirmed to be man missing since 2013
16,"Astronomers have reportedly discovered the brightest object in the universe, a quasar with a rapidly-growing black hole that swallows the equivalent of Earth's Sun per day.","Universe's brightest object reportedly discovered, featuring black hole the size of 17 billion suns"
0,"Senate lawmakers on Sunday voted to push forward an aid package for Ukraine, Israel, and other U.S. allies, clearing a key hurdle as 18 GOP lawmakers have signaled their support.","Senate clears hurdle to passing aid package for Ukraine, Israel as more GOP lawmakers sign on"
0,"Rep. Thomas Massie invited Julian Assange's brother, Gabriel Shipton, as his guest to President Biden's State of the Union address this week.",Rep. Massie bringing Julian Assange's brother as guest to State of the Union
0,"Nancy Pelosi conceded on Monday that President Biden's age was an ""objective fact,"" and noted that he's younger than she is, adding, ""So what do I have to say about his age?""","Nancy Pelosi says Biden's age is an 'objective fact,' argues it's 'all relative': 'He's younger than I am'"
1,"The suspect accused of fatally shooting two people in a Colorado dorm room ""still poses a threat"" to the public and witnesses, the prosecution said in court","Colorado university dorm murder suspect 'still poses a threat,' prosecutor warns judge"
0,Democrats are targeting Rep. Maria Salazar with a video aimed at her claims she brought $40 million to her district despite voting against the legislation that provided some of it.,"WATCH: Vulnerable Republican lampooned for 'embarrassing' exchange with reporter, 'lie' about district funding"
0,"Former Obama advisor David Axelrod claimed President Biden's press conference in response to Special Counsel Robert Hur's report did not solve his age ""problem.""",David Axelrod warns Biden presser 'reinforces the meme' that the president is too old: 'Can't unring the bell'
1,Five people filed a lawsuit after developing liver damage from Las Vegas-based AffinityLifestyles.com water bottles before their recall in 2021. A Nevada jury awarded them damages.,Nevada jury grants $130M to people who suffered liver damage from bottled water
0,Nikki Haley highlights a January fundraising haul of $16.5 million as the last Republican rival to Trump heads to California to hold her first rally in a Super Tuesday state.,Haley touts January fundraising haul ahead of first rally in Super Tuesday state
3,"Some public services in Hong Kong are set to resume on Monday, when thousands of the city's civil servants head back to work, Hong Kong Leader Carrie Lam Cheng Yuet-ngor said.",Hong Kong announces some services set to reopen May 4
