Topic,Document_description,Document_name
1,"America First Legal filed a federal civil rights complaint against the NFL on Tuesday, claiming the Rooney Rule is a violation of the 1964 Civil Rights Act.",Legal group files civil rights complaint against NFL over Rooney Rule: Insulting and condescending
4,"Gary Sinise's son, McCanna ""Mac"" Sinise, has died from a rare form of cancer.",Actor Gary Sinise's son dead following battle with rare form of cancer
0,"The duel between Joe Biden and Donald Trump for the presidency has helped to bring an importantquestion to the fore. Namely, how old is too old to lead?",Biden vs. Trump is forcing Americans to confront the age issue. But no one will answer one big question
1,U.S. Immigration and Customs Enforcement (ICE) Seattle placed a detainer on a Mexican citizen in the country illegally after he was arrested and charged with killing a Washington State Patrol trooper in car crash Saturday.,"Man who crashed into Washington State Patrol trooper, killing him, in US illegally: ICE"
7,Chicago native Cata Truss echoes the outrage from other residents over state and local officials' handling of the migrant crisis on 'The Faulkner Focus.',"Chicago resident defends Texas Gov. Abbott over migrant influx, says she'll vote Republican for first time"
0,"Fox News host Sean Hannity unpacks the visits to the southern border by President Biden and former President Trump on Thursday's ""Hannity.""",SEAN HANNITY: This is the single greatest national security threat in our lifetime
4,"Eric Clapton, the famed guitarist known for ""Layla"" and ""Tears in Heaven,"" has been sober for over three decades. He was married to Jenny Boyd's sister, Pattie Boyd.","Eric Clapton found sobriety 'scary,' feared it would hurt his performance: author"
7,"Brian Wilson's family has filed to place The Beach Boys co-founder under a conservatorship following the death of his wife Melinda Wilson, Fox News Digital confirmed.",Beach Boys co-founder Brian Wilson's family files for conservatorship following dementia diagnosis
5,"A key study in the case against the FDAs abortion pill approval at the Supreme Court has been retracted from an academic journal in a ""partisan assault"" its authors claim.",Key study in FDA abortion pill case at the Supreme Court was retracted in 'partisan assault' authors say
7,"At least 70 African migrants have been discovered living in an illegally converted hostel in Queens New York, where the owner was charging them $300 per month to stay.","Dozens of African migrants found living packed inside store basement, sleeping in shifts"
18,By Bernie McGuire,European Cup players will all play on first day
0,"The Fox News Health Newsletter brings you trending and important stories about health warnings, drug shortages, mental health issues and more in this weekly recap.","Student and teacher share heart surgery scars, plus vaccine risks, plague fears and more"
0,The top House progressive is pushing back on the bipartisan border deal revealed by Senate lawmakers on Sunday night.,Pramila Jayapal says Biden caved to 'extremist views' in bipartisan border deal
17,"Fr. Ambrose Criste of California provides a reflection on the Transfiguration, a Bible story that is read in Catholic churches on the Second Sunday of Lent.",California priest stresses that Second Sunday of Lent is a reminder of why we're here on Earth
2,"Kansas may play USC next December in Wichita, Kan., and it would be a home game for the Trojans.",Kansas may play USC in Wichita
1,"Austin North, star of hit series ""Outer Banks,"" was arrested in Las Vegas after allegedly attacking hospital staff in an emergency room.","'Outer Banks' star Austin North arrested for battery in Las Vegas, claims he was having a panic attack"
4,Human remains that were discovered inside a truck belonged to a man who went missing over a decade ago at an Alabama lake.,Alabama fisherman finds human remains inside truck in lake registered to man reported missing 11 years ago
2,Miami Heat star Jimmy Butler was granted a leave of absence in order to deal with the death of a family member and will miss Sunday's game against the Boston Celtics.,Miamis Jimmy Butler granted leave of absence for death of family member
1,"Judge Scott McAfee on Thursday is hearing evidence related to allegations that district attorney Fani Willis is having an improper"" affair.",Georgia judge set to hear evidence against DA Fani Willis in Trump case that could disqualify her
3,"Israeli Prime Minister Benjamin Netanyahu rejected an offer for cease-fire from Hamas during a press conference on Wednesday, vowing to pursue ""complete victory.""","Netanyahu rejects Hamas cease-fire deal, says 'complete victory' is within a 'matter of months'"
0,"Democrats blocked Sen. Roger Marshall's resolution declaring the border crisis as ""an invasion,"" hindering its advancement on the Senate floor.",California Democrat blocks GOP resolution to declare migrant crisis 'an invasion'
3,"Over 1,500 Greeks gathered Sunday in Athens in protest of legislation that, if enacted, would legalize same-sex marriage in the Balkan nation.",Greeks gather by the thousands in protest of same-sex marriage bill
3,"A tiny drone was flown into a damaged reactor at the Fukushima Daiichi nuclear power plant in Japan, aiming to examine areas where previous robots couldn't reach.",Drone aims to examine Japan's damaged Fukushima nuclear reactor for the first time
9,2012 Team Preview: Richard Childress Racing,3 seems to be magic number at RCR
0,"Hunter Biden was ripped by critics after claiming during an appearance for testimony before Congress that he ""did not involve"" his father, Joe Biden, in his business dealings.",Hunter Biden faces backlash for claiming his father was not involved in business deals: 'Perjuring himself'
1,A Georgia man was arrested and now faces several charges after allegedly printing and using counterfeit $100 bills in multiple areas in the U.S.,"Georgia man arrested for printing, using counterfeit $100 bills"
7,"Bella Hadid's Instagram is filled with controversial ideology about Israel, White people and racial justice, a review of her account found.","Bella Hadid shares Louis Farrakhan, anti-White ideologues on Instagram to 60 million followers"
6,"Adele confessed during a recent concert in her Las Vegas residency that she does not like being famous, and that was why she looked upset in viral photos taken of her at an NBA game.",Adele admits she doesn't 'like being famous' as she explains reason behind viral grumpy meme
3,A top U.N. official stated in a recent television interview that Hamas was a political organization. His comments were met with anger by Israeli officials.,Israel UN ambassador blasts UN official as 'terror collaborator' for calling Hamas a political organization
1,Steven Lopez has been sentenced to 30 years in prison for the fatal 2020 shooting of photographer Tyler Gerth at a protest over the officer-involved death of Breonna Taylor.,Kentucky man gets 30 years for drug-induced killing of photographer at Breonna Taylor protest
5,"State Sen. Tom Brewer has introduced a bill in Nebraska that would permit teachers and staff in schools to carry firearms, aiming to prevent school shootings.",Nebraska bill seeks to allow armed teachers in schools statewide
4,"The top executive in charge of production for Sherri Shepherd's daytime talk show, Sherri,"" was found deceased in his New York home on Feb. 13, according to a recent report.",Top executive for 'Sherri' found dead at home in 'apparent suicide': Report
5,"The Washington state House voted for a bill prohibiting the practice of hog-tying by police in a landslide Wednesday, citing concerns of suffocation risks.",Washington state House passes ban on hog-tying by police in a landslide
1,"A career criminal allegedly killed newlyweds during a Wisconsin bar robbery after a bartender tried to knock the gun out of his gun, court documents allege",Court docs shed light on Wisconsin bar shooting where newlyweds were gunned down
5,"Wisconsin lawmakers were set Thursday to vote on proposals regulating artificial intelligence, with top concerns including political disinformation and child pornography.","Wisconsin lawmakers weigh crackdowns on AI-generated political ads, child porn"
5,The Maryland House and Senate are both advancing bills designed to improve the juvenile justice system in response to an increase in crimes like auto theft and handgun violations.,Rise in Maryland juvenile auto thefts motivates lawmakers to pass juvenile justice bills
1,"The Boston Police Department credited a ""brave bystander"" for the arrest of 38-year-old Miriam Dealmeida, who was charged in a bank robbery.","Brave bystander runs down Boston bank robbery suspect, aids police in arrest"
2,"Jose Valverde began July 30 with a 1.81 ERA, then threw 60 pitches to get four outs in a 6-5 win over the Boston Red Sox that stopped Detroit's four-game losing streak. From that night on, his ERA was 5.89.","After 60-pitch outing, Valverde will be on limit"
9,Daniel Surez was the driver celebrating in Victory Lane at Atlanta Motor Speedway on Sunday night after he closely defeated Kyle Busch and Ryan Blaney.,"Daniel Surez edges Ryan Blaney, Kyle Busch at Ambetter Health 400 by 0.003 seconds"
3,Bidens call for a cease-fire in Israels war against Hamas terrorists has critics raising questions about whether he is abandoning the Jewish state.,Biden under fire for Middle East policy; critics charge he's preventing 'Israel from winning'
0,"The White House touted Democrat Tom Suozzi's victory in New York as a ""devastating repudiation"" of the GOP and former President Trump when it comes to border policy.","White House declares Suozzi victory a 'devastating repudiation' of Trump, Republicans"
2,"Once 0-6, the Boston Red Sox are rolling.",Boston beats Detroit in ninth
7,"An inflammatory Facebook post by an oustpoken member of the Utah Board of Education, Natalie Cline, pushed lawmakers to strip her of committee assignments and administrative duties.",Utah school board member who questioned a student's gender censured by lawmakers
9,"Jake Paul is becoming one of the most notorious names inside the boxing ring, but what he's done on the business side of the sport has made him a ""never-ending machine.""",Jake Paul is basically a never-ending machine for this reason
0,"Former President Trump sat down with Fox News' Sean Hannity at Eagle Pass, Texas on Thursday, calling out Biden and Democrats for the migrant crisis.","Trump declares border a 'war zone,' dings Newsom for doing 'terrible job' as migrant epicenter shifts"
8,Danish Defense Minister Troels Lund Poulsen said Friday that new intelligence indicates Russia could target a NATO country in the next three to five years.,Denmark warns 'new knowledge' indicates Russia could attack NATO in 3 to 5 years: report
3,Cholera is not out of control in the Dominican Republic. To put it clearly: The cholera problem in the island nation of Hispaniola is primarily located in Haiti.,"Despite Reports, Dominican Republic Is Still Safe"
5,Chief Justice Tom Parker alarmed church-state separation advocates by quoting the Bible in his opinion on the Alabama ruling that said frozen embryos are children under state law.,Activists claim Alabama embryo ruling violates separation of church-state
7,"Amid growing antisemitism on elite college campuses in the U.S., a Jewish NGO filed a legal complaint about anti-Jewish conduct and rhetoric they said exists at Middlebury College.",Elite Vermont liberal arts college embroiled in antisemitism scandal: 'Hostile campus climate for Jews'
9,NASCAR Nationwide teams worked diligently to the find the sweetspot on the new generation cars during the second day of testing atDaytona International Speedway on Wednesday.,Next-gen Nationwide cars make strides
3,Jewish singer and social media star Montana Tucker wore a dress on the Grammys red carpet calling to bring home the Israelis who remain hostage in Gaza.,TikTok star dons dress in honor of Israeli hostages at the Grammys: 'Bring them home'
3,"French farmers have again taken to the streets to protest the Macron government's agriculture policies; demanding more aid, and less regulatory burden.",Angry French farmers with tractors are back on the streets of Paris for another protest
4,"Five Argentine nationals and one local were killed in a car crash on a Quintana Roo highway. Two others were injured in the crash, with no immediate word on their condition.","Coastal Mexico car wreck kills 5 Argentine tourists, 1 local"
1,"A man from San Diego, California, was arrested on suspicion of leaving threatening messages for an Arizona election worker who he accused of rigging the 2022 election results.",San Diego man charged for threats to Arizona election worker: 'run' and 'hide'
5,"New York Democrats are pushing a bill that would restrict where voters can challenge alleged gerrymandering to four counties that are heavily Democratic, according to an expert.",NY Dems approve bill that will limit where voters can challenge gerrymandering: 'Rig the game'
4,"Survivors and families of victims of a shipwreck, where 94 migrants, including 35 children, lost their lives off Italys southern coast a year ago, gathered on Monday.",Families of 94 migrants who died in a shipwreck off Italy's southern coast demand justice a year later
0,"President Biden says he spoke with the late German Chancellor Helmut Kohl, who died in 2017, at the G7 meeting in 2021 when recalling past conversations at campaign events on Wednesday.",Biden claims he spoke with German chancellor who died in 2017 at first G7 meeting in latest gaffe
12,"Kurt CyberGuy"" Knutsson says VajraSpy RAT may not be one of the most successful cyber scams out there, but it is sure good at fooling users via Google Play.","What you need to know about VajraSpy RAT, the cyber espionage tool that infiltrated Google Play"
2,"The Chicago Bulls are ready to get going this season with a host of new faces  and they'd like Joakim Noah to be there, too.","Chicago Bulls return to court after offseason of changes, additions; Noah discussing extension"
4,"Stephen tWitch"" Boss, the longtime and beloved dancing DJ on The Ellen DeGeneres Show"" and a former contestant on So You Think You Can Dance,"" died in 2022.","Allison Holker, wife of Stephen ""tWitch"" Boss, finds new purpose after star's death: 'So much gratitude'"
7,"The Privy Council in London has ruled in favor of two residents of Barbuda, John Mussington and Jacklyn Frank, allowing them to challenge the construction of an airport.",Barbuda residents granted legal right to challenge airport construction over environmental concerns
4,"Wilhelmenia Wiggins Fernandez Smith, a soprano opera singer well known for her performance in the French cult-classic film Diva"" has died.",Opera star Wilhelmenia Wiggins Fernandez Smith has died at 75 in Kentucky
4,"A Sarasota, Florida teenager and his friends pulled in a nearly 250-pound goliath grouper while fishing from the shore in Turtle Beach on Saturday night.",Florida high schooler reels in 250-pound goliath grouper from beach
1,"Russell Simmons, 66, who co-founded Def Jam Records, is being sued by a former executive at the company for allegedly raping her in the 1990s.",Russell Simmons sued for alleged rape and sexual assault by former Def Jam music executive
3,"Israeli Prime Minister Benjamin Netanyahu on Friday declared Jerusalem's intent to evacuate the southern Gaza city of Rafah, currently home to some 1.4 million people.",Netanyahu planning to evacuate civilians from large Gaza city as expected invasion looms
0,The Special Counsel report on Biden's mishandling of classified documents revealed the former vice president considered resigning in 2009 over then-President Obama's Afghanistan policy.,Biden considered resigning vice presidency 'in protest' over Obama's Afghanistan policy: Hur report
5,A Virginia House of Delegates subcommittee voted 8-0 Wednesday night to kill a near-total ban on abortion introduced by freshman Republican Del. Tim Griffin.,Virginia House subcommittee unanimously kills near-total abortion ban proposal
1,"Imam Mahjoub Mahjoubi was deported from France 12 hours after being arrested on alleged hate crime charges, according to French Minister of the Interior Grald Darmanin.",'Radical' imam living in France 40 years immediately expelled after allegedly calling French flag 'satanic'
5,"Colorado Democrats, in an 8 to 3 committee vote, blocked a bill that would have required a 4-year minimum sentence for child prostitution crimes.",Colorado Dems kill bill to have harsher penalties for child prostitution crimes
4,"A FedEx hauling two trailers crashed into a guardrail and burst into flames, killing the driver, early Tuesday morning on Interstate 294.","Driver ejected, killed after fiery FedEx semi-truck crash on Interstate"
1,Police are searching for a suspect who shot a woman at a clothing store in Times Square Thursday before he opened fire on responding police.,"Times Square shooting: Gunman on the loose after shooting woman, firing at police"
5,"Critics of the legislative move hit back, arguing ""every pro-life law in the country allows doctors to act"" should a mother's life be in danger and warned against conflating such concerns with fetal anomalies.",Pro-life states consider abortion exceptions in cases of fatal fetal anomalies
3,"Egypt, which borders Israel and Gaza, says they ramped up security over the last two weeks, ahead of Israel's plan to expand their military operations in southern Gaza.",Egypt strengthens its border with Gaza as Israel continues attacks
1,"Lawyers say court limited Trump's testimony in first trial and his statements about her allegations sought to defend his reputation, protect his family, and defend his Presidency.""",Trump legal team files motion for new trial in E Jean Carroll case
6,"Eric Idle is best known for his role in ""Monty Python and the Holy Grail,"" and for writing the hit Broadway play ""Spamalot,"" but says he has to continue working in his 80s for money.","'Monty Python' star Eric Idle, 80, has to 'work for' his living: 'Not easy at this age'"
6,"A Mississippi mom of two boys has been an advocate of the popular ""sittervising"" parenting method ever since she first heard the term from another mother. Fox News Digital spoke with her.",Mom praises viral parenting tactic as she allows her kids to play by themselves: 'Whole new world'
6,"Jennifer Aniston honored Barbra Streisand at the 2024 SAG Awards, and revealed the stars once shared a kiss on New Year's Eve.",Jennifer Aniston reveals she shared a midnight kiss with Barbra Streisand on New Years Eve
7,"A new study from the University of Michigan that was released on Thursday showed that certain practices in charter schools bode success for low-income, non-White students.","Urban charter schools bode success for low-income, non-Whites, college enrollment: Report"
1,Radosh Petrovic and Dusan Obrenovic were sentenced to six months each in jail for attacking NATO-led peacekeepers in Kosovo about a year ago.,Kosovo sentences 2 ethnic Serbs to 6 months each for attacking NATO peacekeepers
15,"Prince Harry spoke about his recent meeting with King Charles during an interview with ""Good Morning America"" host Will Reeve, the son of late ""Superman"" star Christopher Reeve.",Prince Harry's latest TV tell-all raises concern about King Charles' health
6,"A crowd of Christmas carolers gathered in front of 12-year-old Kalina Bushleys home Sunday afternoon as the young girl looked on, smiling through her tears, news4antonio.com reported.",Christmas carolers sing for girl with terminal disease
3,U.S. and French mediators are working furiously to find a peaceful solution to prevent a war between Israel and Lebanon as Hezbollah attacks continue against the Jewish state.,"Odds of Israel-Hezbollah war 'inevitable,' experts fear: 'Totally pessimistic'"
0,Why this sudden infatuation with New Jersey's governor? Because Christie is credible.,I've Fallen In Love -- With Chris Christie
0,"Play the Fox News daily online crossword puzzle - free. Solve daily puzzles, learn new words and help strengthen your mind with games.",Daily Crossword Puzzle Online Games by Fox News
11,The Atlantic diet follows the traditional eating patterns of Portugal and Spain's Galicia region. A growing body of research is finding that the diet yields significant health benefits.,Your guide to the Atlantic diet: How eating like coastal Europeans can boost your health and well-being
2,"Caitlin Clark fell just short of the NCAA women's scoring record last week, but she is expected to surpass the highly coveted mark during Thursday's game against Michigan.",Iowa's Caitlin Clark reveals request for NCAA scoring record-breaking moment: 'Don't stop the game'
5,The Environmental Protection Agency on Thursday announced a final rule allowing drivers in eight Midwestern states to use a higher blend of ethanol year-round.,Gasoline with higher blends of ethanol to be sold in 8 Midwestern states year-round
16,"Spanish archaeologists excavated a 19th century structure that was originally the site of a 14th century building, which was at one point used to produce chocolate.",Archaeologists excavate 700-year-old Barcelona building that once housed a chocolate factory
15,"A royal expert told Fox News Digital that Prince William ""is not meeting"" with his brother Prince Harry during his visit to the U.K. following King Charles' cancer diagnosis.",Prince Harry visits King Charles following cancer diagnosis but not meeting with Prince William: expert
2,"New England Patriots owner Robert Kraft is a large supporter of Taylor Swift, but he suggested she should've dated Rob Gronkowski instead of Travis Kelce.",Patriots owner Robert Kraft jokes Taylor Swift shouldve dated Gronk instead of Travis Kelce
9,Denny Hamlin will hope to start the 2024 NASCAR season off on the right foot with the fourth Daytona 500 victory over his career on Monday.,Denny Hamlin talks Daytona 500 strategy ahead of 'The Great American Race'
4,Vicki Guillot has served her last seafood po-boy.,"No Gulf seafood means no po-boys, anything else at shuttered Louisiana cafe; others hurting"
12,"If your home has an internet connection, you and your family are open targets for cybercriminals. Learn how to protect your home and privacy with tips from tech expert Kim Komando.",Tech security to-do: Lock down your smart stuff
3,"An explosive device was detonated Saturday outside the office of Alabama Attorney General Steve Marshall, he said Monday.",Alabama attorney general says explosive device detonated outside office over weekend
2,"All summer long, NHL Network will be replaying the 2011 Stanley Cup Playoffs -- from every jaw-dropping goal to every highlight-reel save to every crushing defeat.",NHL Network presents: Game 3 2011 ECQF: Penguins vs. Lightning
9,"Kaulig Racing will feature Josh Williams in the No. 11 car on the Xfinity Series for the first time this season, starting with the United Rentals 300 at Daytona Saturday.",Josh Williams ready to make statement at Daytona with Kaulig Racing: 'I just want to go fast'
2,"VANCOUVER - When the Vancouver Canucks played in the Stanley Cup final in 1994, Kayle Moreland wasn't even born yet.","From spaghetti to killer whales, decades of Canucks jerseys on display"
2,"Taylor Swift fans in Tokyo got excited after thinking the pop star was going to perform two songs from her unreleased album, ""The Tortured Poets Department.""",Taylor Swift apologizes after teasing fans with brand new songs on 'Eras Tour' stop in Japan
6,Christie Brinkley is proudly showing off her physique as she celebrates her milestone 70th birthday. The former supermodel posed in a white bra with black leggings as she flexed her muscles in mirror selfies.,Christie Brinkley strips down to her bra as she celebrates turning 70
0,"Sen. Kyrsten Sinema, I-Ariz., reportedly spent over $200k on taxpayer-funded private travel ""to connect"" with voters in Arizona, despite holding no public town halls in recent years.",Kyrsten Sinema did not hold a single public town hall as she spent $200K in taxpayer funds on private flights
0,Fox News Digital talked to experts about the short- and long-term effects of pulling an all-nighter  and how to rebound after a period of missed sleep.,Sleep deprivation dangers: How pulling an all-nighter affects your physical and mental health
9,WWE champion Seth Rollins ripped The Rock for trying to insert himself into the championship picture in place of Cody Rhodes after being out of the company for so long.,"The Rock inserting himself into WWE title picture 'feels pretty gross,' Seth Rollins says"
0,"Sam Bankman-Fried, who founded the now-bankrupt crypto exchange FTX, funneled at least $38.2 million into Democratic campaigns and causes over the last year.","Troubled crypto boss Sam Bankman-Fried, who lost $15B in a week, funneled millions to Dems, far-left causes"
2,Taylor Swift touched down in Las Vegas Sunday afternoon with actress Blake Lively and rapper Ice Spice ahead of the Super Bowl.,"Taylor Swift, Travis Kelce celebrate Chiefs' Super Bowl win with a kiss"
9,"It's time to go racing again. Speedweeks 2012 at Daytona kicks off this weekend, with the Budweiser Shootout scheduled for Saturday and then qualifying for the Daytona 500 slated for Sunday.",This Week in Auto Racing February 17 - 19
0,The White House deputy press secretary Andrew Bates slammed mainstream media journalists for fixating on President Biden's mental abilities after the Hur report.,"White House deputy press secretary complains about media tearing into Biden's age, poor memory"
10,"Older adults in the U.S. should get another COVID-19 booster shot even if they received one in the fall, according to guidance from the CDC. Two doctors react.",CDC recommends additional COVID vaccine for adults 65 and over
