Topic,Document_description,Document_name
4,"Texas Rangers coach Hector Ortiz has died after a battle with cancer, the team announced on Wednesday. He was a longtime coach in the organization and a former catcher.","Hector Ortiz, Rangers coach and former MLB catcher, dead at 54"
0,"HBO's ""Curb Your Enthusiasm"" is relitigating Georgia's 2021 election law reforms in the final season of the long-running comedy based in California.",'Curb Your Enthusiasm' final season takes aim at 2021 Georgia election law with cameo from Stacey Abrams
0,Receive your weekly recap of all the happenings around the world of sports.,"Fox News Sports Huddle Newsletter: A Super Bowl overtime revelation, Spurs sensation posts mind-boggling stats"
9,"A healthy Nadal is too good to not win in Paris again, Agassisays.",Agassi: Nadal an undeniable favorite at French
1,"Kristel Candelario, a 32 year-old Ohio mother, pleaded guilty to aggravated murder after leaving her 16-month-old daughter home alone for ten days while on vacation.",Ohio mom faces life in prison after fatally leaving her toddler home alone to go on 10-day vacation
3,Demonstrators in the Democratic Republic of the Congo burned tires and Western nations' flags in protest of their alleged support for Rwanda.,"Congolese demonstrators burn US, Belgian flags as tensions flare"
3,"South Korea's president on Monday opened the door to possible peace talks with North Korea even as he vowed not to let Pyongyang ""covet even an inch of our territory"" -- looking to strike a delicate balance between diplomacy and strength two days after the North called for better ties with Seoul.","S. Korea Talks Tough, but Opens to Door to Diplomacy"
1,"If a federal judge sentences Michael Cohen to prison Wednesday, he may ask that Cohen report at a future date  or he may demand that the former personal lawyer for President Trump be placed behind bars immediately.",Advice for ex-Trump lawyer Michael Cohen ahead of sentencing: Bring toothbrush to court
0,"GOP White House contender Nikki Haley, asked what she'll do if Donald Trump clinches the Republican presidential nomination next month, tells Fox News Digital ""let's see if that happens.""",Haley on whether Trump will clinch Republican presidential nomination next month: 'Let's see if it happens'
11,Here's a selection of the most amazing images captured around the world in the past seven days. Enjoy!,"The week in pictures, March 14 - March 20"
0,"Senate Majority Leader Chuck Schumer claimed concerns over President Bidens memory following the special counsel report were ""right-wing propaganda.""",Schumer dismisses concern about Biden's mental acuity as 'right-wing propaganda'
5,The Florida Supreme Court will hear arguments over whether a proposed abortion protection amendment can go before voters on November's ballot.,Florida Supreme Court will decide whether abortion amendment belongs on November ballot
16,"Ancient discoveries shed light and answer questions about life thousands of years ago. A recent finding by the Israel Antiquities Authority was a stone box dating back 2,000 years.",Israel Museum in Jerusalem displaying rare stone box dating back 2K years for the 1st time
1,"Cyndi Lauper's son Declyn Lauper was arrested and charged with criminal possession of a weapon following a shooting in New York City on Wednesday, police confirmed to Fox News Digital.",Cyndi Lauper's son arrested in connection to NYC shooting
3,"North Korea threatened unspecified ""responsible"" military action in response to the ongoing joint military drills between South Korea and the U.S.",North Korea threatens military action in response to joint US-South Korean military drills
7,A Christian politician in the UK talked about growing hostility towards Christians after he was reinstated after being canceled for an anti-LGBTQ post.,Christian politician vindicated after having life 'torn apart' for anti-Pride post
0,"Republican presidential candidate Nikki Haley appeared on Fox News @ Night"" on Wednesday to argue that the race will come down to her or Vice President Harris.","Nikki Haley says 'Trump rigged' Nevada, claims it was 'such a scam'"
5,The Republican-controlled House of Representatives passed a bill that would lower the minimum age to buy a firearm to 18 from 21 in a 76-35 vote Friday.,Florida house passes bill to lower minimum age to buy a firearm
12,"Kurt CyberGuy"" Knutsson urges Mac users to stay vigilant. This new backdoor malware from a hacking group in North Korea is targeting your operating system.",Stealthy backdoor Mac malware that can wipe out your files
1,The Nevada Supreme Court dismissed Steve Wynn's defamation lawsuit against The Associated Press over a story alleging he engaged in sexual misconduct.,"Casino mogul Steve Wynn sues The Associated Press for defamation, loses in Nevada Supreme Court"
4,"A fire at a six-story shopping mall in Dhaka, Bangladesh, has left at least 43 people dead and dozens of others injured, according to Health Minister Samanta Lal Sen.",Bangladesh mall fire kills at least 43
3,"Following Monday's meeting between President Biden and Jordan's King Abdullah, the U.S. ally is looking to end the Israel-Hamas war by pushing for a cease-fire.",Jordan's King Abdullah meeting with Biden highlights US ally's dilemma in Israel-Hamas war
6,Singer Phoebe Bridgers called out former Grammys CEO Neil Portnow after Sundays award show for past comments he made about female artists in the industry.,Phoebe Bridgers tells ex-Grammys CEO to rot in piss over past remarks about female artists
17,"Christians should take time during Lent to review their relationship with God and address areas where it may be lacking, says author, evangelist and apologist Alex McFarland of North Carolina.","Christians should take a 'spiritual inventory' during Lent, urges faith leader and author"
0,"New York Times publisher A.G. Sulzberger revealed on Monday that the White House has been ""extremely upset"" about their coverage of President Biden.","White House extremely upset with coverage of Bidens age and unpopularity, New York Times publisher reveals"
3,Fourth-generation farmer John Boyd Jr. blasted the government for sending hundreds of millions to support farmers in Ukraine while farmers in the United States struggle.,4th gen farmer blasts Biden admin for sending billions to Ukraine as US farmers suffer: 'Facing extinction'
4,A Carnival cruise ship spent more time in Jamaica than planned this week after weather caused damage to one of its sides. Passengers react to the delay.,"Carnival cruise ship hosting music festival at sea hits Jamaica pier, leaving passengers stuck on land"
1,The Harford County Sheriff's Office in Maryland released two new sketches of a suspect wanted in connection to the murder of a 37-year-old mother of five found dead in Bel Air.,Rachel Morin murder: Maryland sheriff's office releases new sketches of suspect
1,"Harrowing bodycam video shows a New York man charge police officers at his front door with a knife, stabbing one multiple times before another fatally shot him.","Deadly bodycam shows knife-wielding man attack police responding to 911 call, officers open fire"
0,"""The Ingraham Angle"" host Laura Ingraham offers insight into ""rescue"" efforts aimed at saving President Biden's reelection on ""The Ingraham Angle.""",LAURA INGRAHAM: The claim that Biden is sharper than he appears is an insult to everyone's intelligence
2,"Shortly after he posted a video showing a white substance on a plate next to a credit card, the Arizona Coyotes placed Adam Ruzicka on unconditional waivers.",Arizona Coyotes release player who appeared to post video of white substance
0,Fox News' Laura Ingraham says the open border policy is President Biden's policy on 'The Ingraham Angle.',LAURA INGRAHAM: This murder wouldn't have happened if Dems had put the safety of the American people first
5,"The Kentucky Senate Families and Children Committee has advanced a bill that would allow child support to be collected for unborn children, starting from pregnancy.",Kentucky bill that would allow child support to start with pregnancy advances
14,Caretaker Pakistani Prime Minister Anwaar-ul-Haq Kakar defended his country's controversial delay in the revelation of last week's election results.,"Pakistani leader defends slow vote reporting, notes previous 66-hour tabulation times"
10,"Syphilis is surging in the U.S., reaching the highest numbers in nearly 75 years. Experts comment on potential reasons behind the spread, whos at risk and how to combat the infection.","As syphilis cases surge in the US, heres what infectious disease experts want you to know"
0,"WESTLAKE VILLAGE, Calif. (AP)  A Democrat and a woman, Helen Sargent is the kind of voter that Sen. Barbara Boxer needs this year in her drive for a fourth term in Washington.",California rough terrain for Senate incumbent
3,The IDF has released a video of Hamas leader Yahya Sinwar escaping through a tunnel network days after the groups brutal Oct. 7 attack on Israel.,IDF shares video of Hamas leader Yahya Sinwar escaping through tunnel network
5,A Georgia bill requiring cash bail for 30 additional crimes and tougher restrictions for bail funds is on its way to Gov. Brian Kemp's desk after receiving final approval in the House.,"Georgia bill requiring cash bail for 30 crimes, including misdemeanors, heading to governor's desk"
7,"The No More Lines Coalition vows to end ""discriminatory public school district boundary lines."" Over 30 organizations decry public school district boundaries, calling them ""immoral.""","Sorting kids into public schools based on household income is 'immoral, discriminatory,' says advocacy group"
2,The New York Yankees are reportedly bringing in the big guns when trying to entire free-agent pitchers Gerrit Cole and Stephen Strasburg to sign with the organization.,World Series champion joins Yankees brass to recruit top free-agent pitchers: reports
7,"Tennis player Dejana Radanovic was called ""racist"" after making comments about her three-week stay in India, where she slammed ""food, traffic and hygiene"" of the country.",Tennis star called racist after comments about India following three-week stay
1,"One of the longest-serving death row inmates is set to be executed in Idaho. The convicted murderer has been imprisoned since 1974, but family members say he has a ""gentle soul.""","Idaho death row inmate, 1 of the longest-serving in the US, to be executed via lethal drug"
2,"The Kansas City Chiefs became just the eighth team to ever repeat as Super Bowl champions, but this dynasty now has its eyes set on a three-peat.",Chiefs on the hunt for NFLs elusive three-peat after becoming back-to-back Super Bowl champions
5,Virginia legislators addressed hundreds of bills as the deadline by which all legislation except budget bills must clear its originating chamber arrived.,"Virginia paves the way for marijuana sales, assisted suicide as Assembly deadline looms"
2,Freshman sensation JuJu Watkins' record-setting 42 points in Friday's game against Colorado helped lift the USC Trojans to a seventh consecutive win.,USC basketball star JuJu Watkins drains one-handed basket from behind bench ahead of record-setting night
12,"Wouldn't it be great if you could know what your newborn baby was trying to tell you? Kurt ""CyberGuy"" Knutsson introduces you to Capella, which aims to do that with its new AI app.",AI tool translates what your babys cries mean
0,"Fox News host Laura Ingraham says Democrats, who are dependent on money they receive from rich donors, want to keep the border open on ""The Ingraham Angle.""",LAURA INGRAHAM: It's open season on Americans
3,The Prime Ministers of Canada and Poland are exploring ways to address protests by European farmers against the influx of Ukrainian grain into their markets.,"Poland, Canada seek to redirect exports of Ukrainian crops to world's poorest countries"
3,Author Mitch Albom recounts his harrowing evacuation from Haiti along with nine other volunteers after violence and political unrest engulfed the Caribbean nation.,"Author Mitch Albom, volunteers airlifted out of Haiti amid government collapse: 'It's madness'"
7,New York City Mayor Eric Adams sat down with FOX anchor Rosanna Scotto to discuss the role the Big Apple's sanctuary city status played in fueling its migrant crisis.,Eric Adams warns NYC is 'out of room' amid sanctuary struggle: People will soon be 'sleeping on the streets'
3,President Biden and Jordan's King Abdullah talked about a range of issues related to the Israel-Hamas war that has killed thousands of people in nearly four months.,"Biden meets with Jordanian King Abdullah, calls for Israel to work to achieve peace deal"
4,"Access Bank Group CEO Herbert Wigwe was among six people who were killed in a helicopter crash Friday in the Mojave Desert, Nigerian officials say.",Nigerian bank CEO killed in Mojave Desert helicopter crash in California: 'Irreparable loss'
4,"PM Justin Trudeau announced that Canada will have a state funeral for recently deceased PM Brian Mulroney, who passed away at a hospital in Florida.",Canada plans state funeral for late Prime Minister Brian Mulroney
5,"Voting was underway in Ireland on Friday on a referendum that could legalize abortions in the country, which currently bans the practice except in rare cases when the mothers life is in danger.",Voting underway on Ireland's abortion referendum
3,Thousands of doctors in South Korea are facing potential suspension of their medical licenses as they continue their strike against a plan to increase medical school enrollment.,Seoul moves to prosecute leaders of strike involving thousands of South Korean doctors
1,Fox News' Laura Ingraham says Fulton County DA Fani Willis is a 'rogue prosecutor on a political mission' on 'The Ingraham Angle.',LAURA INGRAHAM: Fani Willis thought this case would catapult her to political fame
8,Convicted Russian arms dealer Viktor Bout says it's too early to say what he'll do next following his release amid U.S. concerns he will return to doing the same type of work he's done in the past.,Russia's swapped convict Viktor Bout says it's 'too soon' to say what he'll do next
5,The websites of several major federal agencies were taken offline Tuesday after Congressional inaction forced a partial shutdown of the U.S. government.,"FTC, USDA, DoJ, other federal websites offline following partial gov't shutdown"
8,"Prominent Vladimir Putin critic and opposition leader Alexei Navalny has died Friday at the age of 47, Russia's prison agency says.","Putin critic Alexei Navalny dead at 47, Russian officials say"
5,"The KY Senate passed a Republican-backed bill that would limit diversity, equity, and inclusion practices at Kentucky's public colleges and universities.",Kentucky Senate approves bill to curb DEI initiatives at public universities
0,Homeland Security Secretary Alejandro Mayorkas was impeached by the House on February 13. Now it's time for the Senate to step up and do its job.,Mayorkas had 3 years to secure our border. Americans deserve a real Senate impeachment trial
5,"By 2025, California wanted to cut the amount of organic waste it sends to landfills by 75% from 2014 levels. But the new recycling practices pose some challenges in implementation.",Behind schedule: California bit off more than it could chew food with food waste recycling goals
9,"Jake Knapp, the latest PGA Tour winner at the Mexico Open, has an origin story for the ages after having to work as a nightclub bouncer to help pay for his golf dream.",PGA Tour winner worked as nightclub bouncer to keep golf dream alive before $1.5M payday
2,"The Baltimore Ravens were the No. 1 seed in the AFC after finishing with a 13-4 regular-season record, but they were ousted by the Kanas City Chiefs.","Ravens' Kyle Hamilton, Kyle Van Noy confident they'll bounce back next year after they 'choked' in title game"
6,"The nominations for the 86th annual Academy Awards are out, and there are a some very happy people in Hollywood right now.",Oscar nominations: The 5 biggest snubs
0,Congressional lawmakers debated whether Homeland Security Secretary Alejandro Mayorkas has failed in his duties to secure the southern border ahead of the House's impeachment vote.,"Mayorkas shows willful ignorance of border crisis, GOP rep says as House tees up historic impeachment vote"
1,"An Illinois judge has ordered the removal of former President Donald Trump from the state's 2024 Republican presidential primary ballot, for violating section three of the 14th Amendment.","Illinois judge removes Trump from state ballot, citing 'insurrectionist ban'"
7,Accomplished Air Force pilot Ed Dwight was primed by John F. Kennedy to be the first Black astronaut when he ran into discrimination. He is now recognized as a pioneer at 90.,"Ed Dwight, first Black astronaut, reflects on his career at age 90"
3,U.S. control of the Central Pacific depends on three treaties that are being held up by $120 million a year in offsets. China will love it if we drop the ball.,Think the US exit from Afghanistan was bad? Look what's brewing in the Pacific
18,By Mark Lamport-Stokes,Steel-nerved McDowell clinches Cup for Europe
8,The European Union will target companies  not countries  that have facilitated the transfer of electronics and technology necessary to produce weapons for Russia.,Beijing bristles as Chinese companies could face sanctions for Russia assistance: report
1,The Sheridan Police Department announced Sgt. Nevada Krinkee was shot and killed in the line of duty on Tuesday while attempting to serve a trespass warning.,"Wyoming police sergeant shot, killed during attempt to serve trespass warning: 'Shocked and saddened'"
4,"A Marathon Airlines-owned passenger jet carrying 106 people returned to Nikola Tesla Airport in Belgrade, Serbia, after striking runway equipment.",Passenger jet severely damaged after hitting runway equipment at Belgrade's Tesla Airport
8,"British authorities on Tuesday charged a sixth Bulgarian national, Tihomir Ivanchev, with spying on Russia's behalf alongside his five codefendants.",UK arrests another Bulgarian national in Russian espionage scheme
3,Commissioners on the National Association of State Departments of Agriculture visited Cuba to explore the market potential of its agricultural sector.,US state agriculture leaders looks to Cuba's private farming sector for possible cooperation
6,"Katy Perry is planning to leave American Idol"" after being a judge for seven seasons. Her exit comes after she faced much criticism and controversy.","Jennifer Lopez, Taylor Swift floated as Katy Perry's 'American Idol' replacement"
12,Natalie Portman has some mixed feelings on artificial intelligence affecting her career in entertainment. She's one of a growing number of celebrities weighing in on the technology.,Natalie Portman says AI could put her out of a job 'soon': Theres a good chance'
4,"Larry David, Cheryl Hines, Jamie Lee Curtis, Albert Brooks, Ringo Starr and other celebrities are mourning the death of comedian Richard Lewis. Lewis died at the age of 76.",Richard Lewis' death made Larry David 'sob' as celebs mourn 'brilliantly funny' comedian
0,"Rep. Eric Swalwell's campaign spent nearly $90,000 on travel during 2023's fourth quarter, including at a five-star resort in Dubai.","Swalwell campaign continues lavish spending, including at 5-star Dubai resort, luxury car service"
4,"An Indiana mother of two died after falling ill on a flight from the Dominican Republic to Charlotte, North Carolina on Wednesday with the flight diverting to Turks and Caicos Islands.","Indiana mother falls ill, dies on American Airlines flight from Dominican Republic"
2,"The quarantine routine of Ross Stripling has been spending much of the last two months working on an island - the one in the kitchen of his Houston home. With baseball halted by the coronavirus pandemic, the Los Angeles Dodgers right-hander returned to his offseason job. When not throwing fastballs, he pitches clients as a financial adviser for B. Riley Wealth Management.",Ross Stripling passes time during coronavirus quarantine by offering financial advice
7,"London Mayor Sadiq Khan is facing backlash after approving art installations for the Fourth Plinth, including an art piece celebrating trans sex workers, instead of the queen.",London mayor under fire for reportedly snubbing queen statue in favor of art celebrating trans prostitutes
0,Arizona Republican U.S. Senate candidate and Sheriff of Pinal County Mark Lamb sounded off on the burgeoning migrant influx on 'Jesse Watters Primetime.',"California 'lost its mind,' Ariz. sheriff says, suggests Chinese government 'complicit' in migrant deluge"
13,GasBuddy has seen an eightfold increase in traffic to the site in the last two weeks as the unrest in Libya pushes up oil prices.,Drivers Race to Websites for Cheap Gas
2,The surging Vancouver Canucks will shoot for a fourth consecutive victory when they visit the Ottawa Senators for tonight's battle at Scotiabank Place.,Surging Canucks continue road trip in Ottawa
1,Four immigrants from Venezuela were arrested and charged Saturday for allegedly robbing and beating a man unconscious on a CTA train in Chicago.,"Chicago police arrest four Venezuelan migrants for allegedly strangling, robbing man on train"
0,"Sen. Joni Ernst, R-Iowa, is calling on the Biden administration to answer for a delayed Free Application for Federal Student Aid (FAFSA) rollout that she says is financially hurting farmers and their families.",GOP senator demands answers from Biden admin on 'confusing' regulation that could crush farming families
0,"Press secretary Karine Jean-Pierre insisted President Biden already ""took questions"" from reporters when he walked by some of them outside the White House.","KJP dismisses reporter's query on Biden's promise to speak to press, claims he already 'took questions'"
9,Tiger Woods son participated in a junior golf event in Florida on Saturday and video of the even appeared to show the child with a sweet swing  just like his father.,"Tiger Woods' son participates in junior golf event, sweet swing delights social media"
1,A southeastern Pennsylvania officer who was wounded in a shooting in over the weekend has been identified by authorities as Chester Police Detective Steve Byrne.,Pennsylvania authorities identify police officer wounded in fatal gunfire exchange
0,"The Fox News Health Newsletter brings you trending and important stories about health warnings, drug shortages, mental health issues and more in this weekly recap.","Kidney swap saves two lives, plus surprising COVID effects and IVF uncertainty"
8,The death of Russian opposition leader Alexey Navalny highlights Russia's continued use of chemical weapons and violation of international law.,Putin's chemical weapons program continues as Russia loses seat on world chemical warfare monitoring agency
7,"Native American activists fear a cancel culture ""firing squad"" will continue to erase indigenous heritage and history while driving a wedge between the American people.","Native Americans fear woke efforts by Kansas City Chiefs, Boy Scouts and Taylor Swift to erase heritage"
19,The Des Moines Art Center plans to remove artwork created in 1996 from a historic park. The decision has sparked opposition from both local residents and the arts community.,Plan to remove 'hazardous' artwork in historic Iowa park sparks opposition
11,"Fry sauce is ubiquitous in the state of Utah, available in most every restaurant and supermarket condiment aisle. It's part ketchup and part mayonnaise.",Utah's ubiquitous fry sauce is the regional king of condiments: 'I love it'
11,Pizza quiz! Test your knowledge of all things pizza-related in this fun and engaging lifestyle quiz. How well do you know these facts about the popular food item?,Pizza quiz! How well do you know the facts about the beloved dish?
1,"A Mexican national with a border crossing card was arrested near Indio, California, after Border Patrol agents allegedly found duffel bags full of meth in his car.","Mexican national arrested for smuggling duffel bags full of meth in California, Border Patrol says"
0,"Stay up to date with the Fox News True Crime Newsletter, which brings you the latest cases ripped from the headlines, from crime to courts, legal and scandal.",Fox News True Crime Newsletter: Brian Laundrie's father slammed in Gabby Petito civil suit
0,Hollywood filmmaker John Sayles claimed he recently visited former President Trump's border wall with a friend and they both urinated on it in protest.,'Lone Star' filmmaker John Sayles claims he urinated on Trump's border wall in protest
3,"The Israeli Defense Forces (IDF) said it fired warning shots"" at a mob of Palestinians who rushed a humanitarian aid convoy early Thursday, leading to more than 100 killed.","IDF says troops fired warning shots as mob rushed aid convoy, leading to more than 100 killed"
1,"Mylik Hill, 33, was convicted Thursday on two counts of attempted murder for shooting an Indianapolis police officer in the throat roughly two years ago.",Man who shot Indianapolis officer in throat convicted of attempted murder
0,White House press secretary Karine Jean-Pierre is defending President Biden after he said he spoke to a world leader in 2021 who actually died in 2017.,White House defends Biden after he mixed up world leaders with dead people: 'It happens'
4,"The Knoxville Police Department in Tennessee announced the death of 32-year-old police recruit Wisbens Antoine, who collapsed during physical training.",Knoxville police recruit dies after collapsing during routine training
13,"Sizing up the oil gusher from the Deepwater Horizon disaster has proven difficult so far, but one scientist suggests that measuring methane in the water could give a better idea of how much oil has spilled into the Gulf of Mexico.",Methane Tracking Could Size Up Gulf Oil Slick
