Topic,Document_description,Document_name
1,"Miami Dolphins star receiver Tyreek Hill is being sued by a social media influencer who claims he broke her leg after being ""humiliated"" during football drills at his home last year.",Dolphins' Tyreek Hill sued by influencer claiming he broke her leg after being 'humiliated' in football drills
5,House Republican leaders are considering plans to fund the government that would lump some of their 12 promised spending bills into two or three separate packages.,House GOP leaders jettison promise to vote on 12 individual spending bills
2,NFL WAGs shared advice for Taylor Swift and Travis Kelce as they face intense scrutiny from the public amid their flourishing relationship. Swift supported Kelce at Super Bowl LVIII.,"Taylor Swift, Travis Kelce get dating advice from Rob Gronkowski's longtime girlfriend: Avoid the noise"
6,"Austin Butler and Timothe Chalamet found some common ground while filming in the sands of ""Dune: Part Two"" with a little help from Elvis and Bob Dylan.",'Elvis' star Austin Butler helped Timothe Chalamet get into character as Bob Dylan
1,"A known gang member was arrested in Weslaco, Texas, Tuesday night after a shooting and hours-long standoff. The suspect will be charged on several counts.",Texas gang member taken into custody after hours-long standoff: police chief
1,Creech received a death sentence in 1983 for murdering a fellow inmate while serving a life sentence for four prior murders.,US appeals court panel declines to delay execution of one of longest-serving death-row inmates
13,"Severe thunderstorms and a tornado outbreak took much of the Great Lakes region by surprise, with violent weather being reported from suburban Chicago to eastern Michigan.","Severe thunderstorms, tornadoes stun Midwest amid bizarre February storm surge"
3,"The U.S. Central Command (CENTCOM) announced that American forces launched a self-defense strike against Houthi forces early Sunday morning, amid tension in the Middle East.","US forces launch self-defense strike on Houthis, accuse group of presenting 'an imminent threat' in Red Sea"
0,Thursday's indictments by Attorney General Eric Holder demonstrates the importance of cooperation from Muslim-Americans who are outraged and frightened by the wave of radicalization that has overtaken so many young people of their faith.,The Justice Department Gets Serious About Terror
1,Texas father David Barnes was sentenced to 21 years in a Russian penal colony this week after his wife allegedly fled to Russia with his two sons.,Texas father detained in Russia sentenced to 21 years in penal colony despite 'almost no evidence'
2,Jackson Mahomes was back in the spotlight over the weekend as he appeared to try to get into a roped-off section at a Super Bowl party in Las Vegas.,Jackson Mahomes back in spotlight as video of him at Super Bowl party goes viral
2,"Taylor Swift will not attend the Kansas City Chiefs' Super Bowl parade as she traveled to Australia for the next stops of her ""Eras Tour."" The international leg kicked off in Japan.",Taylor Swift skips Super Bowl parade as 'Eras Tour' set to resume in Australia
0,"The latest updates from the 2024 campaign trail, exclusive interviews and more Fox News politics content",Fox News Politics: Biden's Muslim problem
15,"Prince Harry and Meghan Markle are expected to attend Sunday's Super Bowl after the Duke of Sussex traveled to England to visit King Charles, who was recently diagnosed with cancer.","Prince Harry, Meghan Markle expected to attend Super Bowl: source"
1,"Fulton County district attorney Fani Willis went viral for her testimony regarding an allegedly ""improper"" affair she had with special prosecutor Nathan Wade.","Fani Willis hearing testimony 'jarring,' 'pure comedy gold,' social media declares"
0,The GOP-led House on Tuesday narrowly voted against the impeachment of DHS Secretary Alejandro Mayorkas over his handling of the ongoing crisis at the southern border.,House fails to impeach DHS Secretary Alejandro Mayorkas in major blow to GOP
6,"Erin Andrews has been one of the most familiar faces on television in recent years, but even she went through a tough battle as a young reporter.",Erin Andrews recalls when former Buccaneers player made her cry: 'I was mortified'
0,"President Biden is facing widespread criticism over his decision to skip the traditional pre-Super Bowl interview, fueling questions on what's behind the move.",Critics rail against Biden for missing Super Bowl interview two years in a row: 'Why the hell not?'
1,An illegal migrant from El Salvador who was arrested in the fatal shooting of a 2-year-old in Maryland was the subject of an ICE deportation request.,ICE called for Salvadoran illegal immigrant to be deported twice before shooting death of 2-year-old
11,"Learn about Vietnam's beloved dish, pho, as we uncover its origins, secret ingredients, eating etiquette and popular variations of this iconic Vietnamese delicacy.",Pho: A guide to the Vietnamese noodle soup
0,"Read the latest from Fox News Opinion & watch videos from Sean Hannity, Raymond Arroyo & more.","Super Bowl losers, America's B-1 bomber versus Iran, and more from Fox News Opinion"
7,"The San Francisco Elections Commission appointed its first non-U.S. citizen to join the body, an immigrant from Hong Kong named Kelly Wong.",Immigrant from Hong Kong becomes first non-US citizen appointed to San Francisco Election Commission
2,The Miami Heat released a statement saying the team was aware that Highsmith was involved in a vehicle after a recent game against the Orlando Magic at Kaseya Center.,"Heats Haywood Highsmith ticketed for careless driving in crash, victim left seriously injured"
9,A PGA professional was taking swings at a driving range when a man came up to her and tried to give her advice she clearly did not need.,PGA professional laughs off unwarranted advice from man at driving range in viral video
4,A woman suffered non-life-threatening injuries after falling from the stands at the 16th hole of TPC Scottsdale during the Waste Management Open.,Woman hospitalized after fall from stands at 16th hole in TPC Scottsdale
3,Sen. Josh Hawley slammed the Biden-Harris campaign for joining TikTok despite legislation banning the app from federal devices.,Hawley calls out Biden campaign for using TikTok after president signed law banning it from federal devices
1,"Marvin Martin III, 50, of Peoria, Illinois, was fatally shot by a Chillicothe police officer after the two exchanged gunfire during a traffic stop in a stolen vehicle investigation.","Illinois man shot multiple times after firing at officer, dying instantly"
1,"A court in Pennsylvania dropped an injunction against an Amish farmer, who suffered a police raid last month, but blocked them from selling raw milk.",Pennsylvania court drops injunction against Amish farmer who suffered from police raid
1,A suspect in Maryland lead police on a chase Friday night after allegedly stealing a Department of Transportation tow truck after a driver arrived to assist someone on the interstate.,"WATCH: Maryland suspect who stole DOT tow truck arrested after wild, lengthy high-speed chase"
1,Maine state police say a man who had a history of getting drunk and lying on the road was killed when he was struck by a truck.,"Maine man lying in roadway struck, killed"
10,"Despite no major increase in major infections of Lyme disease nationally, case numbers jumped nearly 70% in reporting year 2022 due to a procedural reporting requirement.",Change in Lyme disease reporting sees 70% rise in U.S. case counts in 2022
3,Families of Indonesian activists who were kidnapped and tortured 25 years ago protested on Thursday against Prabowo Subianto's apparent presidential victory.,Families of Indonesian activists tortured by soldiers protest as general is reportedly elected president
12,"Kurt CyberGuy"" Knutsson shows you how to create, add or remove people from a group text on your Android device and how to delete the conversation from your device.",How to create or leave a group text on your Android
1,"Police in Sedalia, Missouri, fatally shot a knife-wielding suspect Saturday night following a confrontation during which the individual wounded two officers.",Missouri police fatally shoot suspect who stabbed 2 officers
5,Environmental regulators in Colorado voted unanimously to prohibit the use of gas-powered lawn equipment on state property as part of the state's climate agenda.,Dem state cracks down on gas-powered lawn equipment as part of climate crusade
4,At least seven people were hospitalized after sustaining serious injuries in a Sunday evening shooting at a soccer match in the Cayman Islands.,At least 7 shot at Cayman Islands soccer match
3,"Argentina's government on Sunday described as ""very positive"" an Iranian offer to cooperate in a probe of this South American nation's worst terrorist attack.",Argentina Praises Iran for Help Offer in Bombing Probe
5,"Colorado lawmakers on Wednesday took aim at the state's comparatively lax regulations on funeral homes, on the heels of two recent, egregious cases of mishandled human remains.",Colorado lawmakers eye regulatory funeral home crackdown over mishandled remains cases
2,"Former NFL star wide receiver Chad ""Ochocinco"" Johnson spent a decade competing against the Pittsburgh Steelers in the AFC North division, but his recent suggestion about Pittsburgh's QB position might make some Steelers fans smile.",Chad Johnson tells Shannon Sharpe that Russell Wilson will end up with Steelers: 'A little birdie told me'
2,Cristiano Ronaldo roiled the Saudi Pro League on Sunday with an obscene gesture made toward Al Shabab fans after Al Nassr's 3-2 victory.,Cristiano Ronaldo obscene gesture sparks Saudi soccer investigation: reports
9,Venus has found her footing on clay. Is she ready to win theFrench Open?,Could this be Venus' year at the French?
0,"""The Ingraham Angle"" host Laura Ingraham criticized President Biden's ""enablers"" amid growing concerns over Biden's cognitive abilities.",LAURA INGRAHAM: The world knows the truth - Joe Biden is in serious mental decline
2,"BOSTON -- Michael Ryder scored twice in the Bruins' 5-3 Game 2 win against the Buffalo Sabres Saturday and is a big reason why the Bruins can seize the advantage in the Stanley Cup Playoff series with a win in Game 3 Monday (7 p.m. ET, Versus, CBC).",Ryder hitting on all cylinders
0,"Democrats and allies of former President Donald Trump are trolling Nikki Haley following her loss in the Nevada Republican presidential primary to ""None of these candidates.""","Trump world, Democrats unite in trolling Nikki Haley after loss to 'literally no one' in Nevada primary"
6,Military wife Ashleigh Rodriguez Paez told Fox News Digital that she surprised her husband with their newborn baby last week after he graduated from Navy boot camp.,Navy wife surprises husband with newborn girl during airport reunion: 'It was magic in his eyes'
5,The House of Representatives is set to vote on a package of six spending bills aimed at funding government agencies and departments whose money runs out on Friday.,House to vote on $460 billion government funding package ahead of Friday shutdown deadline
1,"The stars of 1968's ""Romeo & Juliet,"" Olivia Hussey and Leonard Whiting, have filed a new lawsuit over their underage nude scene in the film.",1968s Romeo & Juliet stars Olivia Hussey and Leonard Whiting file new lawsuit over underage nude scene
0,Fox News' Laura Ingraham says the Biden White House will only care about the border when they're in 'political trouble.',LAURA INGRAHAM: The White House's open border policies could cost them the 2024 election
6,"Courteney Cox recently posted a video of herself getting into an ice bath as part of her wellness routine. In the past, she's been open about hypnotism and laser treatments.",'Friends' star Courteney Cox stays young with ice baths and hypnotism: Its worth it
2,The Kansas City Chiefs released a statement following the deadly shooting near their Super Bowl victory rally on Wednesday that left one person dead and many more injured.,Chiefs release statement after fatal shooting near Super Bowl parade: 'Senseless act of violence'
0,Some House members said the bipartisan border deal is already dead after Senate Minority LeaderMitch McConnellreportedly toldRepublicansto vote against the deal.,House member says 'eulogy has already been read' on border bill as Biden blames Trump for stalemate
0,Ohio GOP Senate candidate Frank LaRose told Fox News Digital on the campaign trail that he is the candidate Democrats fear the most in one of the watched 2024 primaries.,Ohio GOP Senate hopeful makes campaign trail pitch as candidate Dems 'most afraid of' in tight race
0,"Jesse Watters discusses the menacing alleged threat to the U.S. from Russia that lawmakers are staying quiet about on ""Jesse Watters Primetime.""",JESSE WATTERS: America is apparently facing a threat 'so terrifying' our government couldn't even tell us?
1,A Norwegian judge rejected the second attempt of far-right extremist and serial killer Anders Behring Breivik to sue the state for what he said was a breach of his human rights.,Norwegian judge rejects mass killer's second attempt to sue state for alleged human rights breach
1,"Two Massachusetts police officers were hospitalized after a woman smashed a ceramic statue on one of the officer's head, causing ""severe bleeding.""","Massachusetts' police officers attacked with ceramic statue, causing bloody mess: 'Severe bleeding'"
1,"Former President Trump said he is a ""believer"" in the United States and a ""believer"" in the Supreme Court after it heard arguments in Colorados effort to remove him from the 2024 ballot in the state.",Trump says he's a 'believer' in the Supreme Court after oral arguments in Colorado ballot case
3,"At least three people, one of whom was 16, were killed by Senegalese security forces amid recent protests over the West African nation's delayed presidential election.","3, including teen, killed by security forces as Senegal election protests rage on"
7,The first Black superintendent of the Green Bay school district has resigned after making remarks about race relations during an appearance on an Atlanta radio show.,Wisconsin school superintendent resigns after making controversial race comments on Atlanta radio show
7,"The Teamsters, one of the largest blue-collar labor unions, earmarked a maximum donation to the Republican National Committee shortly after meeting with former President Donald Trump.","Teamsters union reports max donation of $45,000 to the RNC after meeting with Trump"
3,"The European Union is considering a plan proposed by Poland's new government to address concerns about democratic erosion, potentially ending years of conflict.",European Union considers plan by Poland's government to address democratic concerns
0,The National Border Patrol Council issued a warning to President Biden not to mention the group in the remarks he makes at the southern border on Thursday.,Border Patrol union tells Biden to 'keep our name out of your mouth' ahead of Texas visit
2,"Tech guru Kurt ""CyberGuy"" Knutsson has advice for how to improve your TV setup for this Sunday's Super Bowl between the Kansas City Chiefs and San Francisco 49ers.",How to get your TV game-ready for the Super Bowl
7,A Chicago mother sounded off on the Board of Education after it voted to remove uniformed police officers from some schools in the Windy City.,"Chicago mom decries school board's vote to remove uniformed officers from schools: 'Disappointed, saddened'"
3,"Israeli airstrikes in the southern city of Rafah on Saturday have left 31 Palestinians, including 10 children, dead as Benjamin Netanyahu gears up for a ground invasion there.",Israeli strikes in Rafah leaves 31 Palestinians dead ahead of planned ground invasion
3,"After 18 months of delays, Hungary's President Tams Sulyok signed a bill approving Sweden's NATO bid, clearing the final hurdle for Sweden's membership.","Hungary's president formally signs bill approving Sweden's NATO membership, ending 18-month delay"
9,"Paul Casey is going for his third straight victory at the Valspar Championship, a feat difficult enough that only eight times in the last 40 years has a player won the same tournament at least three times in a row.",Casey goes for 3-peat at Innisbrook against top-heavy field
9,"The Daytona 500 is scheduled for Monday evening. Here is everything you need to know about the 2024 edition of the ""Great American Race.""",Daytona 500: What to know about this year's 'Great American Race'
9,Cristobal del Solar became the first person to shoot a 57 at a PGA Tour-sanctioned event on Thusday at the Astara Golf Championship on the Korn Ferry Tour.,"Korn Ferry Tour golfer shoots 57, breaking record for lowest score at PGA Tour-sanctioned event"
1,A man who has served on a Massachusetts' police force for 14 years was arrested for allegedly shoving Disney World staff members and a deputy last month.,"Former Massachusetts Officer of the Year charged after allegedly shoving Disney World employees, deputy"
1,The NYPD released a new photo of one of the eight suspects who remain at large after a Times Square stabbing attack on a 17-year-old migrant from Nicaragua.,Times Square migrant shelter stabbing attack: Police release new photo of suspect; 8 remain at large
2,C.J. Stroud and Will Anderson Jr. were named the AP Offensive and Defensive Rookies of the Year on Thursday at the NFL Honors in Las Vegas.,"Texans CJ Stroud, Will Anderson Jr named Offensive, Defensive Rookies of the Year"
2,The Philadelphia Eagles raised eyebrows over the weekend when they selected Oklahoma quarterback Jalen Hurts in the second round of the NFL Draft.,Eagles have specific plan for rookie Jalen Hurts: reports
0,"The White House Correspondents Association said it ""will not serve as a repository for the governments views"" after receiving a letter critical of Hur report coverage.","White House Correspondents' Association slams admin letter on Hur coverage as 'misdirected,' 'inappropriate'"
8,"Yulia Navalnaya, the wife of Putin critic Alexei Navalny, is calling on the world to ""defeat the catastrophic regime that is currently in Russia"" following reports that her husband collapsed and died in custody at a penal colony in Siberia.",Alexei Navalny's wife has a message for Putin following news of husband's death
0,President Biden's age and mental acuity have been increasingly scrutinized by the media and even other Democrats following the revelations of Special Counsel Robert Hur's report.,"Questions of Biden's age among Dems, media, comedians keep piling up following Hur report"
11,"Columbia Restaurant in Tampa, Florida, was founded in 1905 by a Cuban immigrant Casimiro Hernandez Sr. It remains a beloved landmark dining destination today.","Florida landmark, Columbia Restaurant, flavored by 'passionate, patriotic' immigrant experience"
4,"Kelvin Kiptum, the marathon world record-holder from Kenya, died in a car crash on Sunday night along with his coach, Gervais Hakizimana, officials say.","Marathon world record-holder Kelvin Kiptum, set to compete in Paris Olympics, dies in car crash"
9,Ilia Topuria stunned the UFC world on Sunday night when he knocked out Alexander Volkanovski to win the UFC Featherweight Championship.,"Ilia Topuria knocks out Alexander Volkanovski to win UFC title, calls out Conor McGregor"
1,"County commissioners in Oxford, Maine wrote a 10-page complaint to the governor of the Pine Tree State in a rare political move to oust controversial Sheriff Christopher Wainwright.",Maine sheriff deemed 'unworthy' of the job asked to step down in letter to the governor
4,"Myles Sanderson, a 32-year-old Canadian man who killed 11 people and injured 17 others in a 2022 attack, died of a cocaine overdose after being taken into custody.","Canadian mass murderer Myles Sanderson died of cocaine overdose, pathologist says"
0,"Vice President Kamala Harris savaged Special Counsel Robert Hur's report on President Biden as ""politically motivated"" and ""inaccurate"" on Friday.",Kamala Harris angrily attacks special counsel who spotlighted Biden memory lapses as 'politically motivated'
3,"President Biden released a memorandum Wednesday stating Palestinian nationals would be protected from deportation for approximately 18 months with ""deferred enforced departure.""",White House announces Palestinians will be protected from deportation by Biden's 'deferred enforced departure'
10,Zimbabwe began an emergency campaign Tuesday to vaccinate over 4 million children against polio after three cases of the disease were detected.,Zimbabwe launches emergency polio vaccination campaign after 3 cases detected
2,"Dennis Rodman, Jamaal Wilkes and Tex Winter were among 12 finalists announced Friday for induction into the Basketball Hall of Fame.",Basketball Hall of Fame announces 12 finalists
1,The Supreme Court ruled unanimously in favor for former President Donald Trump to be allowed on the Colorado presidential primary ballot.,How left and right justices found common ground in restoring Trump to the ballot
16,While other Super-Earths,NASA Telescope Spots 'Godzilla Of Earths'; Planet Has Mass 17 Times That Of Earth
0,Get all the stories you need-to-know from the most powerful name in news delivered first thing every morning to your inbox.,"Haley goes after Trump on economy before SC primary, radio icon deals blow to Biden and more top headlines"
1,Aurora has agreed to pay a family $1.9 million settlement following a 2020 incident where police officers drew their guns on a woman and four minors.,"Police settle $1.9M lawsuit after drawing guns, handcuffing Black family in car theft mix-up"
0,"Lawmakers on both sides of the aisle shared whether they think Vice President Kamala Harris is ""ready to serve"" as President Biden faces increased scrutiny over his age.",'She better be': Kamala Harris says she's 'ready to serve' as president. Here's what AOC says
6,"A man describing himself on Reddit as a carpenter, father and husband shared the age-old dilemma of his wife demanding he help out more around their household during the week.",Man on Reddit is stunned when his wife demands more help around the house: 'I do the best I can'
1,A Marblehead grandmother who crashed her car into a tree while driving her 9-year-old grandson to school has been sentenced to a year in jail on drunken driving and child endangerment charges.,Massachusetts Grandma Gets Jail Term on OUI Charge
1,"Swiss police fatally shot a 32-year-old Iranian man on Thursday after he seized over a dozen hostages on a train, wielding an axe and a knife. No passengers were injured.",Swiss police fatally shoot Iranian man who seized hostages on train with axe and knife
1,"From the ballot removal effort in Washington to the Fulton County, Georgia, prosecutor scandal, cases against former President Donald Trump are floundering.",Trump had one of his best weeks as cases against him appeared to implode
4,"One firefighter is dead, nine others are injured, and two civilians are in the hospital after a home explosion ""leveled"" a residence in Sterling, Virginia.","Virginia firefighter killed, 11 injured after gas leak explosion 'levels' residence: 'Enormous boom'"
0,"North Dakota's lieutenant governor, Tammy Miller, has entered the open gubernatorial race as a Republican candidate, competing against Rep. Kelly Armstrong.",North Dakota Lt. Gov. Tammy Miller enters gubernatorial bid against congressman
6,"Jennifer Lopez and Ben Affleck shared in her new documentary, ""The Greatest Love Story Never Told,"" what led to calling of their wedding and ending their early 2000s relationship.",Jennifer Lopez and Ben Affleck crumbled under the pressure before calling off their 2003 wedding
1,"Christian Blake Bunyard, 21, has been sentenced to over three years in prison for using Snapchat to make threats to rape, shoot and kill.","Mississippi man gets over 3 years for racist, homicidal threats made on Snapchat"
0,"Read the latest from Fox News Opinion & watch videos from Sean Hannity, Raymond Arroyo & more.","Gavin Newsom's 'sausage-making,' Ric Flair's haters, and more from Fox News Opinion"
7,Fox News Radio host Guy Benson discusses how Mayor Eric Adams has begun to pivot on New York City's sanctuary city laws after an uptick in migrant violence.,Migrant crime forcing 'dramatic' political shift as NYC mayor calls for sanctuary law changes: Benson
4,"Lt. Col. Troy Bartley, 57, of Alton, Illinois, died a non-combat-related death Sunday at Camp Arifjan in Kuwait, according to the Army Reserve Command.",US Army dietitian dies in Kuwait
1,The national Girl Scouts organization is in damage control after a St. Louis troop was scolded by its local council over its pro-Palestinian fundraiser.,Girl Scouts 'regret any hurt caused' by regional council trying to stop troop's pro-Palestinian fundraiser
12,Luum is using artificial intelligence and robotics to offer high-tech eyelash extension services. Luum CEO Nathan Harding and president Jo Lawson shared details on how it works.,AI comes to the world of beauty as eyelash robot uses artificial intelligence to place fake lashes
3,A German Navy ship has set sail toward the Red Sea to participate in a European Union mission aimed at defending cargo ships from attacks by Yemen's Houthi rebels.,German military ship sails toward Red Sea to join EU mission against Houthi attacks
2,"Basketball Hall of Fame coach Charles ""Lefty"" Driesell helped build Maryland into a national power and went on to win more than 100 games with four different program.","Longtime Maryland men's basketball coach Lefty Driesell dies at 92, school says"
